,0,text,polarity,subjectivity,sentiment,tokenized,nonstop,stemmed
302,"@F1 Not much has changed for the current Ferrari drivers, has it? Poor Charles....",f not much has changed for the current ferrari drivers has it poor charles,-0.16666666666666666,0.4000000000000001,negative,"['f', 'not', 'much', 'has', 'changed', 'for', 'the', 'current', 'ferrari', 'drivers', 'has', 'it', 'poor', 'charles']","['f', 'much', 'changed', 'current', 'ferrari', 'drivers', 'poor', 'charles']","['f', 'much', 'chang', 'current', 'ferrari', 'driver', 'poor', 'charl']"
303,"@EDO14_ @F1 In 08, Ferrari double pitted cause of the on purpose crash. No cheating= Massa WDC.
In 21 masi let them race! Like he did on lap 1 of AD and back in silverstone when lewis shoulda been penalized or in Baku when lewis forgot to turn left or in Hungary when bottas went bowling.","edo f in  ferrari double pitted cause of the on purpose crash no cheating massa wdc
in  masi let them race like he did on lap  of ad and back in silverstone when lewis shoulda been penalized or in baku when lewis forgot to turn left or in hungary when bottas went bowling",0.0,0.0,negative,"['edo', 'f', 'in', 'ferrari', 'double', 'pitted', 'cause', 'of', 'the', 'on', 'purpose', 'crash', 'no', 'cheating', 'massa', 'wdc', 'in', 'masi', 'let', 'them', 'race', 'like', 'he', 'did', 'on', 'lap', 'of', 'ad', 'and', 'back', 'in', 'silverstone', 'when', 'lewis', 'shoulda', 'been', 'penalized', 'or', 'in', 'baku', 'when', 'lewis', 'forgot', 'to', 'turn', 'left', 'or', 'in', 'hungary', 'when', 'bottas', 'went', 'bowling']","['edo', 'f', 'ferrari', 'double', 'pitted', 'cause', 'purpose', 'crash', 'cheating', 'massa', 'wdc', 'masi', 'let', 'race', 'like', 'lap', 'ad', 'back', 'silverstone', 'lewis', 'shoulda', 'penalized', 'baku', 'lewis', 'forgot', 'turn', 'left', 'hungary', 'bottas', 'went', 'bowling']","['edo', 'f', 'ferrari', 'doubl', 'pit', 'caus', 'purpos', 'crash', 'cheat', 'massa', 'wdc', 'masi', 'let', 'race', 'like', 'lap', 'ad', 'back', 'silverston', 'lewi', 'shoulda', 'penal', 'baku', 'lewi', 'forgot', 'turn', 'left', 'hungari', 'botta', 'went', 'bowl']"
304,@F1 Classic Ferrari move this one,f classic ferrari move this one,0.16666666666666666,0.16666666666666666,neutral,"['f', 'classic', 'ferrari', 'move', 'this', 'one']","['f', 'classic', 'ferrari', 'move', 'one']","['f', 'classic', 'ferrari', 'move', 'one']"
305,Say what you want but Ferrari is consistent. https://t.co/qq9nhROl3F,say what you want but ferrari is consistent httpstcoqqnhrolf,0.25,0.25,positive,"['say', 'what', 'you', 'want', 'but', 'ferrari', 'is', 'consistent', 'httpstcoqqnhrolf']","['say', 'want', 'ferrari', 'consistent', 'httpstcoqqnhrolf']","['say', 'want', 'ferrari', 'consist', 'httpstcoqqnhrolf']"
306,@impartialf1fan @F1 Ferrari stopped him from winning the WDC because they cocked the pit stop up - Massa had to make dozens of pit stops for that race + the rest of the year.,impartialffan f ferrari stopped him from winning the wdc because they cocked the pit stop up  massa had to make dozens of pit stops for that race  the rest of the year,0.5,0.75,negative,"['impartialffan', 'f', 'ferrari', 'stopped', 'him', 'from', 'winning', 'the', 'wdc', 'because', 'they', 'cocked', 'the', 'pit', 'stop', 'up', 'massa', 'had', 'to', 'make', 'dozens', 'of', 'pit', 'stops', 'for', 'that', 'race', 'the', 'rest', 'of', 'the', 'year']","['impartialffan', 'f', 'ferrari', 'stopped', 'winning', 'wdc', 'cocked', 'pit', 'stop', 'massa', 'make', 'dozens', 'pit', 'stops', 'race', 'rest', 'year']","['impartialffan', 'f', 'ferrari', 'stop', 'win', 'wdc', 'cock', 'pit', 'stop', 'massa', 'make', 'dozen', 'pit', 'stop', 'race', 'rest', 'year']"
307,Former F1 driver reflects on the unique “weight” the Ferrari team carries on its shoulders https://t.co/t6d4WmRSqH,former f driver reflects on the unique “weight” the ferrari team carries on its shoulders httpstcotdwmrsqh,0.1875,0.5,neutral,"['former', 'f', 'driver', 'reflects', 'on', 'the', 'unique', 'weight', 'the', 'ferrari', 'team', 'carries', 'on', 'its', 'shoulders', 'httpstcotdwmrsqh']","['former', 'f', 'driver', 'reflects', 'unique', 'weight', 'ferrari', 'team', 'carries', 'shoulders', 'httpstcotdwmrsqh']","['former', 'f', 'driver', 'reflect', 'uniqu', 'weight', 'ferrari', 'team', 'carri', 'shoulder', 'httpstcotdwmrsqh']"
308,"Race week as a F1 fan: 😁
Race week as a Vettel/Alonso/Ferrari fan: 🥲","race week as a f fan 😁
race week as a vettelalonsoferrari fan 🥲",0.0,0.0,positive,"['race', 'week', 'as', 'a', 'f', 'fan', 'race', 'week', 'as', 'a', 'vettelalonsoferrari', 'fan', '']","['race', 'week', 'f', 'fan', 'race', 'week', 'vettelalonsoferrari', 'fan', '']","['race', 'week', 'f', 'fan', 'race', 'week', 'vettelalonsoferrari', 'fan', '']"
309,"@F1 If fueling during the race was allowed today, Ferrari would definitely do this again with LeClerc 😂",f if fueling during the race was allowed today ferrari would definitely do this again with leclerc 😂,0.0,0.5,positive,"['f', 'if', 'fueling', 'during', 'the', 'race', 'was', 'allowed', 'today', 'ferrari', 'would', 'definitely', 'do', 'this', 'again', 'with', 'leclerc', '']","['f', 'fueling', 'race', 'allowed', 'today', 'ferrari', 'would', 'definitely', 'leclerc', '']","['f', 'fuel', 'race', 'allow', 'today', 'ferrari', 'would', 'definit', 'leclerc', '']"
310,"@F1 Ah yes, the ol’ Ferrari",f ah yes the ol’ ferrari,0.0,0.0,positive,"['f', 'ah', 'yes', 'the', 'ol', 'ferrari']","['f', 'ah', 'yes', 'ol', 'ferrari']","['f', 'ah', 'ye', 'ol', 'ferrari']"
311,It's a Ferrari thing https://t.co/1cbOohhEm6,its a ferrari thing httpstcocboohhem,0.0,0.0,neutral,"['its', 'a', 'ferrari', 'thing', 'httpstcocboohhem']","['ferrari', 'thing', 'httpstcocboohhem']","['ferrari', 'thing', 'httpstcocboohhem']"
312,"13/9/1991
#F1News
3:33pm

NICHOLS LEAVES FERRARI

Revered F1 designer &amp; Senna fan Steve Nichols has surprisingly left his position at #Ferrari.
The team are expected to confirm the re-appointment of John Barnard as replacement who originally left at the end of 1989.
#RetroF1 #F1 https://t.co/eTLt9DyPqv","
fnews
pm

nichols leaves ferrari

revered f designer amp senna fan steve nichols has surprisingly left his position at ferrari
the team are expected to confirm the reappointment of john barnard as replacement who originally left at the end of 
retrof f httpstcoetltdypqv",-0.03333333333333333,0.13333333333333333,positive,"['', 'fnews', 'pm', 'nichols', 'leaves', 'ferrari', 'revered', 'f', 'designer', 'amp', 'senna', 'fan', 'steve', 'nichols', 'has', 'surprisingly', 'left', 'his', 'position', 'at', 'ferrari', 'the', 'team', 'are', 'expected', 'to', 'confirm', 'the', 'reappointment', 'of', 'john', 'barnard', 'as', 'replacement', 'who', 'originally', 'left', 'at', 'the', 'end', 'of', 'retrof', 'f', 'httpstcoetltdypqv']","['', 'fnews', 'pm', 'nichols', 'leaves', 'ferrari', 'revered', 'f', 'designer', 'amp', 'senna', 'fan', 'steve', 'nichols', 'surprisingly', 'left', 'position', 'ferrari', 'team', 'expected', 'confirm', 'reappointment', 'john', 'barnard', 'replacement', 'originally', 'left', 'end', 'retrof', 'f', 'httpstcoetltdypqv']","['', 'fnew', 'pm', 'nichol', 'leav', 'ferrari', 'rever', 'f', 'design', 'amp', 'senna', 'fan', 'steve', 'nichol', 'surprisingli', 'left', 'posit', 'ferrari', 'team', 'expect', 'confirm', 'reappoint', 'john', 'barnard', 'replac', 'origin', 'left', 'end', 'retrof', 'f', 'httpstcoetltdypqv']"
313,"Which one do you like more, Ferrari 250 GTO or the McLaren F1? (IG 📹 tfjj) #ferrari #mclaren https://t.co/9H4cGBRPmQ",which one do you like more ferrari  gto or the mclaren f ig 📹 tfjj ferrari mclaren httpstcohcgbrpmq,0.5,0.5,positive,"['which', 'one', 'do', 'you', 'like', 'more', 'ferrari', 'gto', 'or', 'the', 'mclaren', 'f', 'ig', 'tfjj', 'ferrari', 'mclaren', 'httpstcohcgbrpmq']","['one', 'like', 'ferrari', 'gto', 'mclaren', 'f', 'ig', 'tfjj', 'ferrari', 'mclaren', 'httpstcohcgbrpmq']","['one', 'like', 'ferrari', 'gto', 'mclaren', 'f', 'ig', 'tfjj', 'ferrari', 'mclaren', 'httpstcohcgbrpmq']"
314,The former F1 driver reflects the unique “weight” that the Ferrari team carries on his shoulders https://t.co/MVEhU8jKXz,the former f driver reflects the unique “weight” that the ferrari team carries on his shoulders httpstcomvehujkxz,0.1875,0.5,neutral,"['the', 'former', 'f', 'driver', 'reflects', 'the', 'unique', 'weight', 'that', 'the', 'ferrari', 'team', 'carries', 'on', 'his', 'shoulders', 'httpstcomvehujkxz']","['former', 'f', 'driver', 'reflects', 'unique', 'weight', 'ferrari', 'team', 'carries', 'shoulders', 'httpstcomvehujkxz']","['former', 'f', 'driver', 'reflect', 'uniqu', 'weight', 'ferrari', 'team', 'carri', 'shoulder', 'httpstcomvehujkxz']"
315,"Ferrari have bottled it multiple times before at Singapore, let this be another one on that list. CHAMPIONSHIP secured. https://t.co/VMU9i5WcC0",ferrari have bottled it multiple times before at singapore let this be another one on that list championship secured httpstcovmuiwcc,0.0,0.0,positive,"['ferrari', 'have', 'bottled', 'it', 'multiple', 'times', 'before', 'at', 'singapore', 'let', 'this', 'be', 'another', 'one', 'on', 'that', 'list', 'championship', 'secured', 'httpstcovmuiwcc']","['ferrari', 'bottled', 'multiple', 'times', 'singapore', 'let', 'another', 'one', 'list', 'championship', 'secured', 'httpstcovmuiwcc']","['ferrari', 'bottl', 'multipl', 'time', 'singapor', 'let', 'anoth', 'one', 'list', 'championship', 'secur', 'httpstcovmuiwcc']"
316,@F1 I feel silly thinking the Ferrari problems in the pits is something new. I guess they’ve sucked for a long time. So weird for a team that’s regarded as one of the top.,f i feel silly thinking the ferrari problems in the pits is something new i guess they’ve sucked for a long time so weird for a team that’s regarded as one of the top,-0.08272727272727272,0.6459090909090909,negative,"['f', 'i', 'feel', 'silly', 'thinking', 'the', 'ferrari', 'problems', 'in', 'the', 'pits', 'is', 'something', 'new', 'i', 'guess', 'they', 've', 'sucked', 'for', 'a', 'long', 'time', 'so', 'weird', 'for', 'a', 'team', 'that', 's', 'regarded', 'as', 'one', 'of', 'the', 'top']","['f', 'feel', 'silly', 'thinking', 'ferrari', 'problems', 'pits', 'something', 'new', 'guess', 'sucked', 'long', 'time', 'weird', 'team', 'regarded', 'one', 'top']","['f', 'feel', 'silli', 'think', 'ferrari', 'problem', 'pit', 'someth', 'new', 'guess', 'suck', 'long', 'time', 'weird', 'team', 'regard', 'one', 'top']"
317,@Carlossainz55 @Ferrari Post driving for @F1 you should really consider starting a new career in modeling. Just saying 🤭,carlossainz ferrari post driving for f you should really consider starting a new career in modeling just saying 🤭,0.11212121212121212,0.2515151515151515,neutral,"['carlossainz', 'ferrari', 'post', 'driving', 'for', 'f', 'you', 'should', 'really', 'consider', 'starting', 'a', 'new', 'career', 'in', 'modeling', 'just', 'saying', '']","['carlossainz', 'ferrari', 'post', 'driving', 'f', 'really', 'consider', 'starting', 'new', 'career', 'modeling', 'saying', '']","['carlossainz', 'ferrari', 'post', 'drive', 'f', 'realli', 'consid', 'start', 'new', 'career', 'model', 'say', '']"
318,Hopefully #F1 #SingaporeGP will go better for Ferrari this year! #VroomVroom @DriverzNFT https://t.co/zsqZqko55H,hopefully f singaporegp will go better for ferrari this year vroomvroom driverznft httpstcozsqzqkoh,0.5,0.5,positive,"['hopefully', 'f', 'singaporegp', 'will', 'go', 'better', 'for', 'ferrari', 'this', 'year', 'vroomvroom', 'driverznft', 'httpstcozsqzqkoh']","['hopefully', 'f', 'singaporegp', 'go', 'better', 'ferrari', 'year', 'vroomvroom', 'driverznft', 'httpstcozsqzqkoh']","['hope', 'f', 'singaporegp', 'go', 'better', 'ferrari', 'year', 'vroomvroom', 'driverznft', 'httpstcozsqzqkoh']"
319,@irvine_andrew @ant_iuculano @F1 But if there is some illegal on a car it won’t bring out a SC which alters the entire race. Ferrari also had to change from their automatic release to a manual one due to it being a busy pit lane.,irvineandrew antiuculano f but if there is some illegal on a car it won’t bring out a sc which alters the entire race ferrari also had to change from their automatic release to a manual one due to it being a busy pit lane,-0.13125,0.45,negative,"['irvineandrew', 'antiuculano', 'f', 'but', 'if', 'there', 'is', 'some', 'illegal', 'on', 'a', 'car', 'it', 'won', 't', 'bring', 'out', 'a', 'sc', 'which', 'alters', 'the', 'entire', 'race', 'ferrari', 'also', 'had', 'to', 'change', 'from', 'their', 'automatic', 'release', 'to', 'a', 'manual', 'one', 'due', 'to', 'it', 'being', 'a', 'busy', 'pit', 'lane']","['irvineandrew', 'antiuculano', 'f', 'illegal', 'car', 'bring', 'sc', 'alters', 'entire', 'race', 'ferrari', 'also', 'change', 'automatic', 'release', 'manual', 'one', 'due', 'busy', 'pit', 'lane']","['irvineandrew', 'antiuculano', 'f', 'illeg', 'car', 'bring', 'sc', 'alter', 'entir', 'race', 'ferrari', 'also', 'chang', 'automat', 'releas', 'manual', 'one', 'due', 'busi', 'pit', 'lane']"
320,@L_Mcs9 @skydixe @AbzSemtex @F1 He literally got double overtaken by Lewis. Also not to mention Mercedes were the third fastest car with the ferrari being 5 tenths faster than the mercedes,lmcs skydixe abzsemtex f he literally got double overtaken by lewis also not to mention mercedes were the third fastest car with the ferrari being  tenths faster than the mercedes,0.0,0.0,neutral,"['lmcs', 'skydixe', 'abzsemtex', 'f', 'he', 'literally', 'got', 'double', 'overtaken', 'by', 'lewis', 'also', 'not', 'to', 'mention', 'mercedes', 'were', 'the', 'third', 'fastest', 'car', 'with', 'the', 'ferrari', 'being', 'tenths', 'faster', 'than', 'the', 'mercedes']","['lmcs', 'skydixe', 'abzsemtex', 'f', 'literally', 'got', 'double', 'overtaken', 'lewis', 'also', 'mention', 'mercedes', 'third', 'fastest', 'car', 'ferrari', 'tenths', 'faster', 'mercedes']","['lmc', 'skydix', 'abzsemtex', 'f', 'liter', 'got', 'doubl', 'overtaken', 'lewi', 'also', 'mention', 'merced', 'third', 'fastest', 'car', 'ferrari', 'tenth', 'faster', 'merced']"
321,The former F1 driver reflects the unique “weight” that the Ferrari team carries on his shoulders https://t.co/FB1EOJbxMg,the former f driver reflects the unique “weight” that the ferrari team carries on his shoulders httpstcofbeojbxmg,0.1875,0.5,neutral,"['the', 'former', 'f', 'driver', 'reflects', 'the', 'unique', 'weight', 'that', 'the', 'ferrari', 'team', 'carries', 'on', 'his', 'shoulders', 'httpstcofbeojbxmg']","['former', 'f', 'driver', 'reflects', 'unique', 'weight', 'ferrari', 'team', 'carries', 'shoulders', 'httpstcofbeojbxmg']","['former', 'f', 'driver', 'reflect', 'uniqu', 'weight', 'ferrari', 'team', 'carri', 'shoulder', 'httpstcofbeojbxmg']"
322,"@Mikkle101 @ant_iuculano @F1 Yes, but that‘s Renault’s fault not Ham’s or anybody else’s. Massa &amp; Ham were on the same fuel strategy and Ferrari made a mistake under pressure.

If a car is found to be illegal after a race, would you want the race to be invalidated or just that car dsq‘d?","mikkle antiuculano f yes but that‘s renault’s fault not ham’s or anybody else’s massa amp ham were on the same fuel strategy and ferrari made a mistake under pressure

if a car is found to be illegal after a race would you want the race to be invalidated or just that car dsq‘d",-0.25,0.3125,negative,"['mikkle', 'antiuculano', 'f', 'yes', 'but', 'that', 's', 'renault', 's', 'fault', 'not', 'ham', 's', 'or', 'anybody', 'else', 's', 'massa', 'amp', 'ham', 'were', 'on', 'the', 'same', 'fuel', 'strategy', 'and', 'ferrari', 'made', 'a', 'mistake', 'under', 'pressure', 'if', 'a', 'car', 'is', 'found', 'to', 'be', 'illegal', 'after', 'a', 'race', 'would', 'you', 'want', 'the', 'race', 'to', 'be', 'invalidated', 'or', 'just', 'that', 'car', 'dsq', 'd']","['mikkle', 'antiuculano', 'f', 'yes', 'renault', 'fault', 'ham', 'anybody', 'else', 'massa', 'amp', 'ham', 'fuel', 'strategy', 'ferrari', 'made', 'mistake', 'pressure', 'car', 'found', 'illegal', 'race', 'would', 'want', 'race', 'invalidated', 'car', 'dsq']","['mikkl', 'antiuculano', 'f', 'ye', 'renault', 'fault', 'ham', 'anybodi', 'els', 'massa', 'amp', 'ham', 'fuel', 'strategi', 'ferrari', 'made', 'mistak', 'pressur', 'car', 'found', 'illeg', 'race', 'would', 'want', 'race', 'invalid', 'car', 'dsq']"
323,well at least ferrari are consistent https://t.co/MHgv5YIEas,well at least ferrari are consistent httpstcomhgvyieas,-0.024999999999999994,0.325,positive,"['well', 'at', 'least', 'ferrari', 'are', 'consistent', 'httpstcomhgvyieas']","['well', 'least', 'ferrari', 'consistent', 'httpstcomhgvyieas']","['well', 'least', 'ferrari', 'consist', 'httpstcomhgvyiea']"
324,"‼️ Why Ferrari are facing a pressure that doesn't affect other F1 teams ⤵️🏎👇

https://t.co/OPKJdH0oKT","‼️ why ferrari are facing a pressure that doesnt affect other f teams ⤵️🏎👇

httpstcoopkjdhokt",-0.125,0.375,negative,"['', 'why', 'ferrari', 'are', 'facing', 'a', 'pressure', 'that', 'doesnt', 'affect', 'other', 'f', 'teams', 'httpstcoopkjdhokt']","['', 'ferrari', 'facing', 'pressure', 'doesnt', 'affect', 'f', 'teams', 'httpstcoopkjdhokt']","['', 'ferrari', 'face', 'pressur', 'doesnt', 'affect', 'f', 'team', 'httpstcoopkjdhokt']"
325,"@RyanInglis02 @Perez7K @F1DataAnalysis @FormulaRacer420 @alo_oficial Massa himself said that accident didn't affect at all in his performance.

Massa did well vs Schumacher but didn't really challenged him.

Alonso destroyed Raikkonen with bigger margin than he destroyed Massa.

Alonso in Ferrari is one of the best prime in F1 history.","ryaninglis perezk fdataanalysis formularacer alooficial massa himself said that accident didnt affect at all in his performance

massa did well vs schumacher but didnt really challenged him

alonso destroyed raikkonen with bigger margin than he destroyed massa

alonso in ferrari is one of the best prime in f history",0.39999999999999997,0.3333333333333333,negative,"['ryaninglis', 'perezk', 'fdataanalysis', 'formularacer', 'alooficial', 'massa', 'himself', 'said', 'that', 'accident', 'didnt', 'affect', 'at', 'all', 'in', 'his', 'performance', 'massa', 'did', 'well', 'vs', 'schumacher', 'but', 'didnt', 'really', 'challenged', 'him', 'alonso', 'destroyed', 'raikkonen', 'with', 'bigger', 'margin', 'than', 'he', 'destroyed', 'massa', 'alonso', 'in', 'ferrari', 'is', 'one', 'of', 'the', 'best', 'prime', 'in', 'f', 'history']","['ryaninglis', 'perezk', 'fdataanalysis', 'formularacer', 'alooficial', 'massa', 'said', 'accident', 'didnt', 'affect', 'performance', 'massa', 'well', 'vs', 'schumacher', 'didnt', 'really', 'challenged', 'alonso', 'destroyed', 'raikkonen', 'bigger', 'margin', 'destroyed', 'massa', 'alonso', 'ferrari', 'one', 'best', 'prime', 'f', 'history']","['ryaningli', 'perezk', 'fdataanalysi', 'formularac', 'aloofici', 'massa', 'said', 'accid', 'didnt', 'affect', 'perform', 'massa', 'well', 'vs', 'schumach', 'didnt', 'realli', 'challeng', 'alonso', 'destroy', 'raikkonen', 'bigger', 'margin', 'destroy', 'massa', 'alonso', 'ferrari', 'one', 'best', 'prime', 'f', 'histori']"
326,@F1 Ferrari without progress,f ferrari without progress,0.0,0.0,negative,"['f', 'ferrari', 'without', 'progress']","['f', 'ferrari', 'without', 'progress']","['f', 'ferrari', 'without', 'progress']"
327,Long time Ferrari a do the clown shit https://t.co/L5rYs8fd3M,long time ferrari a do the clown shit httpstcolrysfdm,-0.125,0.6000000000000001,negative,"['long', 'time', 'ferrari', 'a', 'do', 'the', 'clown', 'shit', 'httpstcolrysfdm']","['long', 'time', 'ferrari', 'clown', 'shit', 'httpstcolrysfdm']","['long', 'time', 'ferrari', 'clown', 'shit', 'httpstcolrysfdm']"
328,Ferrari will always be Ferrari https://t.co/ky0JsUsd6M,ferrari will always be ferrari httpstcokyjsusdm,0.0,0.0,neutral,"['ferrari', 'will', 'always', 'be', 'ferrari', 'httpstcokyjsusdm']","['ferrari', 'always', 'ferrari', 'httpstcokyjsusdm']","['ferrari', 'alway', 'ferrari', 'httpstcokyjsusdm']"
329,"@ant_iuculano @F1 It was Renault who broke the rules. They should be the ones hit.

Ferrari just messed up, nothing else. At least that cannot happen now since you cannot refuel.","antiuculano f it was renault who broke the rules they should be the ones hit

ferrari just messed up nothing else at least that cannot happen now since you cannot refuel",-0.3,0.4,negative,"['antiuculano', 'f', 'it', 'was', 'renault', 'who', 'broke', 'the', 'rules', 'they', 'should', 'be', 'the', 'ones', 'hit', 'ferrari', 'just', 'messed', 'up', 'nothing', 'else', 'at', 'least', 'that', 'cannot', 'happen', 'now', 'since', 'you', 'cannot', 'refuel']","['antiuculano', 'f', 'renault', 'broke', 'rules', 'ones', 'hit', 'ferrari', 'messed', 'nothing', 'else', 'least', 'cannot', 'happen', 'since', 'cannot', 'refuel']","['antiuculano', 'f', 'renault', 'broke', 'rule', 'one', 'hit', 'ferrari', 'mess', 'noth', 'els', 'least', 'cannot', 'happen', 'sinc', 'cannot', 'refuel']"
330,"12/9/1991
#F1 BREAKING NEWS
9am

🚨FERRARI CONFIRM ANDRETTI FOR '92

#Ferrari have confirmed Italian GP winner Michael #Andretti will stay on at the team for 1992 with the American partnering Ayrton Senna once more.
Speaking of the news, Luca di Montezemolo said:
#GP2 #RetroF1 https://t.co/ncJQ1RPEbc","
f breaking news
am

🚨ferrari confirm andretti for 

ferrari have confirmed italian gp winner michael andretti will stay on at the team for  with the american partnering ayrton senna once more
speaking of the news luca di montezemolo said
gp retrof httpstconcjqrpebc",0.225,0.375,positive,"['', 'f', 'breaking', 'news', 'am', 'ferrari', 'confirm', 'andretti', 'for', 'ferrari', 'have', 'confirmed', 'italian', 'gp', 'winner', 'michael', 'andretti', 'will', 'stay', 'on', 'at', 'the', 'team', 'for', 'with', 'the', 'american', 'partnering', 'ayrton', 'senna', 'once', 'more', 'speaking', 'of', 'the', 'news', 'luca', 'di', 'montezemolo', 'said', 'gp', 'retrof', 'httpstconcjqrpebc']","['', 'f', 'breaking', 'news', 'ferrari', 'confirm', 'andretti', 'ferrari', 'confirmed', 'italian', 'gp', 'winner', 'michael', 'andretti', 'stay', 'team', 'american', 'partnering', 'ayrton', 'senna', 'speaking', 'news', 'luca', 'di', 'montezemolo', 'said', 'gp', 'retrof', 'httpstconcjqrpebc']","['', 'f', 'break', 'news', 'ferrari', 'confirm', 'andretti', 'ferrari', 'confirm', 'italian', 'gp', 'winner', 'michael', 'andretti', 'stay', 'team', 'american', 'partner', 'ayrton', 'senna', 'speak', 'news', 'luca', 'di', 'montezemolo', 'said', 'gp', 'retrof', 'httpstconcjqrpebc']"
331,"@skydixe @MrrLH44 @AbzSemtex @F1 im afraid if hamilcar was good enough he could’ve won in hungary and zandvoort, they had the advantage on both ferrari and rb in those races but hamilcar isnt good enough😕🥺",skydixe mrrlh abzsemtex f im afraid if hamilcar was good enough he could’ve won in hungary and zandvoort they had the advantage on both ferrari and rb in those races but hamilcar isnt good enough😕🥺,0.19999999999999998,0.65,positive,"['skydixe', 'mrrlh', 'abzsemtex', 'f', 'im', 'afraid', 'if', 'hamilcar', 'was', 'good', 'enough', 'he', 'could', 've', 'won', 'in', 'hungary', 'and', 'zandvoort', 'they', 'had', 'the', 'advantage', 'on', 'both', 'ferrari', 'and', 'rb', 'in', 'those', 'races', 'but', 'hamilcar', 'isnt', 'good', 'enough', '']","['skydixe', 'mrrlh', 'abzsemtex', 'f', 'im', 'afraid', 'hamilcar', 'good', 'enough', 'could', 'hungary', 'zandvoort', 'advantage', 'ferrari', 'rb', 'races', 'hamilcar', 'isnt', 'good', 'enough', '']","['skydix', 'mrrlh', 'abzsemtex', 'f', 'im', 'afraid', 'hamilcar', 'good', 'enough', 'could', 'hungari', 'zandvoort', 'advantag', 'ferrari', 'rb', 'race', 'hamilcar', 'isnt', 'good', 'enough', '']"
332,"@Bigmarian @JJayne3 @LaverCup @FTiafoe Ermmm....and you are a Ferrari fan,  the biggest chokers in F1.",bigmarian jjayne lavercup ftiafoe ermmmand you are a ferrari fan  the biggest chokers in f,0.0,0.0,positive,"['bigmarian', 'jjayne', 'lavercup', 'ftiafoe', 'ermmmand', 'you', 'are', 'a', 'ferrari', 'fan', 'the', 'biggest', 'chokers', 'in', 'f']","['bigmarian', 'jjayne', 'lavercup', 'ftiafoe', 'ermmmand', 'ferrari', 'fan', 'biggest', 'chokers', 'f']","['bigmarian', 'jjayn', 'lavercup', 'ftiafo', 'ermmmand', 'ferrari', 'fan', 'biggest', 'choker', 'f']"
333,@F1 It is incredible that Ferrari lost 2 WDC on 2 pit stops.,f it is incredible that ferrari lost  wdc on  pit stops,0.9,0.9,negative,"['f', 'it', 'is', 'incredible', 'that', 'ferrari', 'lost', 'wdc', 'on', 'pit', 'stops']","['f', 'incredible', 'ferrari', 'lost', 'wdc', 'pit', 'stops']","['f', 'incred', 'ferrari', 'lost', 'wdc', 'pit', 'stop']"
334,@AthensRivers @taeoct6 @SaycheeseDGTL Might as well get a Koenigsegg or Pagani if you want rep. Ferrari’s production cars aren’t what they used to be &amp; Lambos are better road cars. Ferrari still has a pretty good f1 team though,athensrivers taeoct saycheesedgtl might as well get a koenigsegg or pagani if you want rep ferrari’s production cars aren’t what they used to be amp lambos are better road cars ferrari still has a pretty good f team though,0.48333333333333334,0.7000000000000001,positive,"['athensrivers', 'taeoct', 'saycheesedgtl', 'might', 'as', 'well', 'get', 'a', 'koenigsegg', 'or', 'pagani', 'if', 'you', 'want', 'rep', 'ferrari', 's', 'production', 'cars', 'aren', 't', 'what', 'they', 'used', 'to', 'be', 'amp', 'lambos', 'are', 'better', 'road', 'cars', 'ferrari', 'still', 'has', 'a', 'pretty', 'good', 'f', 'team', 'though']","['athensrivers', 'taeoct', 'saycheesedgtl', 'might', 'well', 'get', 'koenigsegg', 'pagani', 'want', 'rep', 'ferrari', 'production', 'cars', 'used', 'amp', 'lambos', 'better', 'road', 'cars', 'ferrari', 'still', 'pretty', 'good', 'f', 'team', 'though']","['athensriv', 'taeoct', 'saycheesedgtl', 'might', 'well', 'get', 'koenigsegg', 'pagani', 'want', 'rep', 'ferrari', 'product', 'car', 'use', 'amp', 'lambo', 'better', 'road', 'car', 'ferrari', 'still', 'pretti', 'good', 'f', 'team', 'though']"
