,0,text,polarity,subjectivity,sentiment,tokenized,nonstop,stemmed
165,"@L_Mcs9 @Veronicaa112 @F1 @ChrisMedlandF1 ferrari was faster at the start of the season and somehow max still won, wheres your logic m8?",lmcs veronicaa f chrismedlandf ferrari was faster at the start of the season and somehow max still won wheres your logic m,0.0,0.0,positive,"['lmcs', 'veronicaa', 'f', 'chrismedlandf', 'ferrari', 'was', 'faster', 'at', 'the', 'start', 'of', 'the', 'season', 'and', 'somehow', 'max', 'still', 'won', 'wheres', 'your', 'logic', 'm']","['lmcs', 'veronicaa', 'f', 'chrismedlandf', 'ferrari', 'faster', 'start', 'season', 'somehow', 'max', 'still', 'wheres', 'logic']","['lmc', 'veronicaa', 'f', 'chrismedlandf', 'ferrari', 'faster', 'start', 'season', 'somehow', 'max', 'still', 'where', 'logic']"
166,"@Veronicaa112 @F1 @ChrisMedlandF1 true, max has a car that's in average 5 tenths faster than the ferrari and bottles pole every race, gets carried by his rocketship in the race and his team not screwing lmfao botlling pole with a car 5 tenths faster and flexing it😭😭",veronicaa f chrismedlandf true max has a car thats in average  tenths faster than the ferrari and bottles pole every race gets carried by his rocketship in the race and his team not screwing lmfao botlling pole with a car  tenths faster and flexing it😭😭,0.09999999999999999,0.525,positive,"['veronicaa', 'f', 'chrismedlandf', 'true', 'max', 'has', 'a', 'car', 'thats', 'in', 'average', 'tenths', 'faster', 'than', 'the', 'ferrari', 'and', 'bottles', 'pole', 'every', 'race', 'gets', 'carried', 'by', 'his', 'rocketship', 'in', 'the', 'race', 'and', 'his', 'team', 'not', 'screwing', 'lmfao', 'botlling', 'pole', 'with', 'a', 'car', 'tenths', 'faster', 'and', 'flexing', 'it', '']","['veronicaa', 'f', 'chrismedlandf', 'true', 'max', 'car', 'thats', 'average', 'tenths', 'faster', 'ferrari', 'bottles', 'pole', 'every', 'race', 'gets', 'carried', 'rocketship', 'race', 'team', 'screwing', 'lmfao', 'botlling', 'pole', 'car', 'tenths', 'faster', 'flexing', '']","['veronicaa', 'f', 'chrismedlandf', 'true', 'max', 'car', 'that', 'averag', 'tenth', 'faster', 'ferrari', 'bottl', 'pole', 'everi', 'race', 'get', 'carri', 'rocketship', 'race', 'team', 'screw', 'lmfao', 'botll', 'pole', 'car', 'tenth', 'faster', 'flex', '']"
167,"@artsbys16 color : like a pale pink!
weather : sunny
f1 car : a ferrari 
driver : zhou!
animal : cat!","artsbys color  like a pale pink
weather  sunny
f car  a ferrari 
driver  zhou
animal  cat",-0.155,0.24,positive,"['artsbys', 'color', 'like', 'a', 'pale', 'pink', 'weather', 'sunny', 'f', 'car', 'a', 'ferrari', 'driver', 'zhou', 'animal', 'cat']","['artsbys', 'color', 'like', 'pale', 'pink', 'weather', 'sunny', 'f', 'car', 'ferrari', 'driver', 'zhou', 'animal', 'cat']","['artsbi', 'color', 'like', 'pale', 'pink', 'weather', 'sunni', 'f', 'car', 'ferrari', 'driver', 'zhou', 'anim', 'cat']"
168,"@F1 @ChrisMedlandF1 It's quite likely tbf, Perez is shite and Ferrari is useless",f chrismedlandf its quite likely tbf perez is shite and ferrari is useless,-0.25,0.6,negative,"['f', 'chrismedlandf', 'its', 'quite', 'likely', 'tbf', 'perez', 'is', 'shite', 'and', 'ferrari', 'is', 'useless']","['f', 'chrismedlandf', 'quite', 'likely', 'tbf', 'perez', 'shite', 'ferrari', 'useless']","['f', 'chrismedlandf', 'quit', 'like', 'tbf', 'perez', 'shite', 'ferrari', 'useless']"
169,@F1 average ferrari weekend,f average ferrari weekend,-0.15,0.39999999999999997,neutral,"['f', 'average', 'ferrari', 'weekend']","['f', 'average', 'ferrari', 'weekend']","['f', 'averag', 'ferrari', 'weekend']"
170,"This was peak “Ferrari” before Ferrari started Ferrariing really hard. 

If you know what I mean. https://t.co/tSSFa6r8cb","this was peak “ferrari” before ferrari started ferrariing really hard 

if you know what i mean httpstcotssfarcb",-0.30208333333333337,0.6145833333333333,negative,"['this', 'was', 'peak', 'ferrari', 'before', 'ferrari', 'started', 'ferrariing', 'really', 'hard', 'if', 'you', 'know', 'what', 'i', 'mean', 'httpstcotssfarcb']","['peak', 'ferrari', 'ferrari', 'started', 'ferrariing', 'really', 'hard', 'know', 'mean', 'httpstcotssfarcb']","['peak', 'ferrari', 'ferrari', 'start', 'ferrari', 'realli', 'hard', 'know', 'mean', 'httpstcotssfarcb']"
171,"F1 22 - PRL OPEN LOBBIES - LIVE STREAM #48 - N7 GAMES 

#Ferrari #mclarenf1 #alpinef1
#PRL #F1 #F122 #F122Game #PlayStation #MAKAVELI #Formula1 #MercedesAMGF1 #Racing #racinggames #MonacoGP  #LiveStream #N7 #SaudiArabia #jeddah #Miami #CARS 

https://t.co/zNOdno8qal via @YouTube https://t.co/6GzuHqybQ1","f   prl open lobbies  live stream   n games 

ferrari mclarenf alpinef
prl f f fgame playstation makaveli formula mercedesamgf racing racinggames monacogp  livestream n saudiarabia jeddah miami cars 

httpstcoznodnoqal via youtube httpstcogzuhqybq",0.06818181818181818,0.5,neutral,"['f', 'prl', 'open', 'lobbies', 'live', 'stream', 'n', 'games', 'ferrari', 'mclarenf', 'alpinef', 'prl', 'f', 'f', 'fgame', 'playstation', 'makaveli', 'formula', 'mercedesamgf', 'racing', 'racinggames', 'monacogp', 'livestream', 'n', 'saudiarabia', 'jeddah', 'miami', 'cars', 'httpstcoznodnoqal', 'via', 'youtube', 'httpstcogzuhqybq']","['f', 'prl', 'open', 'lobbies', 'live', 'stream', 'n', 'games', 'ferrari', 'mclarenf', 'alpinef', 'prl', 'f', 'f', 'fgame', 'playstation', 'makaveli', 'formula', 'mercedesamgf', 'racing', 'racinggames', 'monacogp', 'livestream', 'n', 'saudiarabia', 'jeddah', 'miami', 'cars', 'httpstcoznodnoqal', 'via', 'youtube', 'httpstcogzuhqybq']","['f', 'prl', 'open', 'lobbi', 'live', 'stream', 'n', 'game', 'ferrari', 'mclarenf', 'alpinef', 'prl', 'f', 'f', 'fgame', 'playstat', 'makav', 'formula', 'mercedesamgf', 'race', 'racinggam', 'monacogp', 'livestream', 'n', 'saudiarabia', 'jeddah', 'miami', 'car', 'httpstcoznodnoq', 'via', 'youtub', 'httpstcogzuhqybq']"
172,@f1_headassery 7 year old me cheering for Ferrari/Me now cheering for Haas going to Q2,fheadassery  year old me cheering for ferrarime now cheering for haas going to q,0.1,0.2,positive,"['fheadassery', 'year', 'old', 'me', 'cheering', 'for', 'ferrarime', 'now', 'cheering', 'for', 'haas', 'going', 'to', 'q']","['fheadassery', 'year', 'old', 'cheering', 'ferrarime', 'cheering', 'haas', 'going', 'q']","['fheadasseri', 'year', 'old', 'cheer', 'ferrarim', 'cheer', 'haa', 'go', 'q']"
173,Ferrari's strategists are like the Harry Mcguire of F1,ferraris strategists are like the harry mcguire of f,0.0,0.0,positive,"['ferraris', 'strategists', 'are', 'like', 'the', 'harry', 'mcguire', 'of', 'f']","['ferraris', 'strategists', 'like', 'harry', 'mcguire', 'f']","['ferrari', 'strategist', 'like', 'harri', 'mcguir', 'f']"
174,The latest The Krister Lindholm Experience! https://t.co/675ptipeaE Thanks to @MotorsportWeek @t2telegraph @FerrariRaces #ferrari #f1,the latest the krister lindholm experience httpstcoptipeae thanks to motorsportweek ttelegraph ferrariraces ferrari f,0.35,0.55,positive,"['the', 'latest', 'the', 'krister', 'lindholm', 'experience', 'httpstcoptipeae', 'thanks', 'to', 'motorsportweek', 'ttelegraph', 'ferrariraces', 'ferrari', 'f']","['latest', 'krister', 'lindholm', 'experience', 'httpstcoptipeae', 'thanks', 'motorsportweek', 'ttelegraph', 'ferrariraces', 'ferrari', 'f']","['latest', 'krister', 'lindholm', 'experi', 'httpstcoptipea', 'thank', 'motorsportweek', 'ttelegraph', 'ferrarirac', 'ferrari', 'f']"
175,"@Lexalinho @psgfan_16 @DrJass__ @sanspptapeurrr @OffTrack_FR In 2012 Ferrari was 4th fastest, they matched Lotus after the horrible start but were no near Red Bull and McLaren.

Alonso's 2012 is considered one of the greatest individual performances in F1 history.","lexalinho psgfan drjass sanspptapeurrr offtrackfr in  ferrari was th fastest they matched lotus after the horrible start but were no near red bull and mclaren

alonsos  is considered one of the greatest individual performances in f history",-0.010000000000000009,0.5599999999999999,positive,"['lexalinho', 'psgfan', 'drjass', 'sanspptapeurrr', 'offtrackfr', 'in', 'ferrari', 'was', 'th', 'fastest', 'they', 'matched', 'lotus', 'after', 'the', 'horrible', 'start', 'but', 'were', 'no', 'near', 'red', 'bull', 'and', 'mclaren', 'alonsos', 'is', 'considered', 'one', 'of', 'the', 'greatest', 'individual', 'performances', 'in', 'f', 'history']","['lexalinho', 'psgfan', 'drjass', 'sanspptapeurrr', 'offtrackfr', 'ferrari', 'th', 'fastest', 'matched', 'lotus', 'horrible', 'start', 'near', 'red', 'bull', 'mclaren', 'alonsos', 'considered', 'one', 'greatest', 'individual', 'performances', 'f', 'history']","['lexalinho', 'psgfan', 'drjass', 'sanspptapeurrr', 'offtrackfr', 'ferrari', 'th', 'fastest', 'match', 'lotu', 'horribl', 'start', 'near', 'red', 'bull', 'mclaren', 'alonso', 'consid', 'one', 'greatest', 'individu', 'perform', 'f', 'histori']"
176,"F1 STAT 269/365

The last six races in Singapore has seen only Mercedes, Ferrari and Red Bull finish on the podium.","f stat 

the last six races in singapore has seen only mercedes ferrari and red bull finish on the podium",0.0,0.35555555555555557,neutral,"['f', 'stat', 'the', 'last', 'six', 'races', 'in', 'singapore', 'has', 'seen', 'only', 'mercedes', 'ferrari', 'and', 'red', 'bull', 'finish', 'on', 'the', 'podium']","['f', 'stat', 'last', 'six', 'races', 'singapore', 'seen', 'mercedes', 'ferrari', 'red', 'bull', 'finish', 'podium']","['f', 'stat', 'last', 'six', 'race', 'singapor', 'seen', 'merced', 'ferrari', 'red', 'bull', 'finish', 'podium']"
177,nicolas todt then and now: never breathe and live peacefully because his talents drive for ferrari😭 https://t.co/yMPGRJ1Lsl,nicolas todt then and now never breathe and live peacefully because his talents drive for ferrari😭 httpstcoympgrjlsl,0.19318181818181818,0.5,positive,"['nicolas', 'todt', 'then', 'and', 'now', 'never', 'breathe', 'and', 'live', 'peacefully', 'because', 'his', 'talents', 'drive', 'for', 'ferrari', 'httpstcoympgrjlsl']","['nicolas', 'todt', 'never', 'breathe', 'live', 'peacefully', 'talents', 'drive', 'ferrari', 'httpstcoympgrjlsl']","['nicola', 'todt', 'never', 'breath', 'live', 'peac', 'talent', 'drive', 'ferrari', 'httpstcoympgrjlsl']"
178,"ROUND 17 takes place in Singapore after 2 years not racing here f1 is back last time the gp was won by @sebastianvettel with @scuderiaferrari 

#formula1 #f1 #redbullracing #mercedesamg #ferrari #alphataurif1 #astonmartinf1 #haas #alfaromeo #alpine #mclaren #williamsf1 #pirelli https://t.co/fdJJHm9zdb","round  takes place in singapore after  years not racing here f is back last time the gp was won by sebastianvettel with scuderiaferrari 

formula f redbullracing mercedesamg ferrari alphataurif astonmartinf haas alfaromeo alpine mclaren williamsf pirelli httpstcofdjjhmzdb",-0.06666666666666667,0.15555555555555556,positive,"['round', 'takes', 'place', 'in', 'singapore', 'after', 'years', 'not', 'racing', 'here', 'f', 'is', 'back', 'last', 'time', 'the', 'gp', 'was', 'won', 'by', 'sebastianvettel', 'with', 'scuderiaferrari', 'formula', 'f', 'redbullracing', 'mercedesamg', 'ferrari', 'alphataurif', 'astonmartinf', 'haas', 'alfaromeo', 'alpine', 'mclaren', 'williamsf', 'pirelli', 'httpstcofdjjhmzdb']","['round', 'takes', 'place', 'singapore', 'years', 'racing', 'f', 'back', 'last', 'time', 'gp', 'sebastianvettel', 'scuderiaferrari', 'formula', 'f', 'redbullracing', 'mercedesamg', 'ferrari', 'alphataurif', 'astonmartinf', 'haas', 'alfaromeo', 'alpine', 'mclaren', 'williamsf', 'pirelli', 'httpstcofdjjhmzdb']","['round', 'take', 'place', 'singapor', 'year', 'race', 'f', 'back', 'last', 'time', 'gp', 'sebastianvettel', 'scuderiaferrari', 'formula', 'f', 'redbullrac', 'mercedesamg', 'ferrari', 'alphataurif', 'astonmartinf', 'haa', 'alfaromeo', 'alpin', 'mclaren', 'williamsf', 'pirelli', 'httpstcofdjjhmzdb']"
179,#TJ13 #F1 - Todt statement on Ferrari &amp; Leclerc’s failure https://t.co/Mf8T8Il5Ge,tj f  todt statement on ferrari amp leclerc’s failure httpstcomftilge,-0.3166666666666667,0.3,negative,"['tj', 'f', 'todt', 'statement', 'on', 'ferrari', 'amp', 'leclerc', 's', 'failure', 'httpstcomftilge']","['tj', 'f', 'todt', 'statement', 'ferrari', 'amp', 'leclerc', 'failure', 'httpstcomftilge']","['tj', 'f', 'todt', 'statement', 'ferrari', 'amp', 'leclerc', 'failur', 'httpstcomftilg']"
180,@SchultzenJoakim Don't worrt it's like Ferrari F1. They have very dramatic ups and downs.,schultzenjoakim dont worrt its like ferrari f they have very dramatic ups and downs,-0.5633333333333334,0.78,negative,"['schultzenjoakim', 'dont', 'worrt', 'its', 'like', 'ferrari', 'f', 'they', 'have', 'very', 'dramatic', 'ups', 'and', 'downs']","['schultzenjoakim', 'dont', 'worrt', 'like', 'ferrari', 'f', 'dramatic', 'ups', 'downs']","['schultzenjoakim', 'dont', 'worrt', 'like', 'ferrari', 'f', 'dramat', 'up', 'down']"
181,@ScrotyBoogerba1 @RyanODo41314975 @PaschalTosin @sportbible We can say that about every champion tbh. Mika Salo would’ve won in ‘99 filling in for Schumacher at the German GP. Ferrari made him let his teammate go. But that Mercedes was literally the quickest F1 car in history and it was on the shortest track in history.,scrotyboogerba ryanodo paschaltosin sportbible we can say that about every champion tbh mika salo would’ve won in ‘ filling in for schumacher at the german gp ferrari made him let his teammate go but that mercedes was literally the quickest f car in history and it was on the shortest track in history,0.0,0.0,positive,"['scrotyboogerba', 'ryanodo', 'paschaltosin', 'sportbible', 'we', 'can', 'say', 'that', 'about', 'every', 'champion', 'tbh', 'mika', 'salo', 'would', 've', 'won', 'in', 'filling', 'in', 'for', 'schumacher', 'at', 'the', 'german', 'gp', 'ferrari', 'made', 'him', 'let', 'his', 'teammate', 'go', 'but', 'that', 'mercedes', 'was', 'literally', 'the', 'quickest', 'f', 'car', 'in', 'history', 'and', 'it', 'was', 'on', 'the', 'shortest', 'track', 'in', 'history']","['scrotyboogerba', 'ryanodo', 'paschaltosin', 'sportbible', 'say', 'every', 'champion', 'tbh', 'mika', 'salo', 'would', 'filling', 'schumacher', 'german', 'gp', 'ferrari', 'made', 'let', 'teammate', 'go', 'mercedes', 'literally', 'quickest', 'f', 'car', 'history', 'shortest', 'track', 'history']","['scrotyboogerba', 'ryanodo', 'paschaltosin', 'sportbibl', 'say', 'everi', 'champion', 'tbh', 'mika', 'salo', 'would', 'fill', 'schumach', 'german', 'gp', 'ferrari', 'made', 'let', 'teammat', 'go', 'merced', 'liter', 'quickest', 'f', 'car', 'histori', 'shortest', 'track', 'histori']"
182,👩🏻‍🦰: Ferrari being Ferrari since 2008. It’s not Binottos fault they always were incompetents https://t.co/uF4HiB9cDf,👩🏻‍🦰 ferrari being ferrari since  it’s not binottos fault they always were incompetents httpstcoufhibcdf,0.0,0.0,positive,"['', 'ferrari', 'being', 'ferrari', 'since', 'it', 's', 'not', 'binottos', 'fault', 'they', 'always', 'were', 'incompetents', 'httpstcoufhibcdf']","['', 'ferrari', 'ferrari', 'since', 'binottos', 'fault', 'always', 'incompetents', 'httpstcoufhibcdf']","['', 'ferrari', 'ferrari', 'sinc', 'binotto', 'fault', 'alway', 'incompet', 'httpstcoufhibcdf']"
183,Pitpass F1: Ferrari remains committed to young driver support #F1: https://t.co/Y67wQuCGtm!,pitpass f ferrari remains committed to young driver support f httpstcoywqucgtm,0.1,0.4,positive,"['pitpass', 'f', 'ferrari', 'remains', 'committed', 'to', 'young', 'driver', 'support', 'f', 'httpstcoywqucgtm']","['pitpass', 'f', 'ferrari', 'remains', 'committed', 'young', 'driver', 'support', 'f', 'httpstcoywqucgtm']","['pitpass', 'f', 'ferrari', 'remain', 'commit', 'young', 'driver', 'support', 'f', 'httpstcoywqucgtm']"
184,"@celluloidspectr I agree re works of art but I generally prefer 50’s - 70’s sports cars as being the most beautiful works of art like the E Type Jag, Ferrari 246 Dino, Ferrari 250 GTO, MGA and many others. F1 - I prefer the highlights. Otherwise Netflix F1 Drive to Survive behind the scenes 👍",celluloidspectr i agree re works of art but i generally prefer ’s  ’s sports cars as being the most beautiful works of art like the e type jag ferrari  dino ferrari  gto mga and many others f  i prefer the highlights otherwise netflix f drive to survive behind the scenes 👍,0.3,0.64,positive,"['celluloidspectr', 'i', 'agree', 're', 'works', 'of', 'art', 'but', 'i', 'generally', 'prefer', 's', 's', 'sports', 'cars', 'as', 'being', 'the', 'most', 'beautiful', 'works', 'of', 'art', 'like', 'the', 'e', 'type', 'jag', 'ferrari', 'dino', 'ferrari', 'gto', 'mga', 'and', 'many', 'others', 'f', 'i', 'prefer', 'the', 'highlights', 'otherwise', 'netflix', 'f', 'drive', 'to', 'survive', 'behind', 'the', 'scenes', '']","['celluloidspectr', 'agree', 'works', 'art', 'generally', 'prefer', 'sports', 'cars', 'beautiful', 'works', 'art', 'like', 'e', 'type', 'jag', 'ferrari', 'dino', 'ferrari', 'gto', 'mga', 'many', 'others', 'f', 'prefer', 'highlights', 'otherwise', 'netflix', 'f', 'drive', 'survive', 'behind', 'scenes', '']","['celluloidspectr', 'agre', 'work', 'art', 'gener', 'prefer', 'sport', 'car', 'beauti', 'work', 'art', 'like', 'e', 'type', 'jag', 'ferrari', 'dino', 'ferrari', 'gto', 'mga', 'mani', 'other', 'f', 'prefer', 'highlight', 'otherwis', 'netflix', 'f', 'drive', 'surviv', 'behind', 'scene', '']"
185,Ferrari remains committed to young driver support https://t.co/EIZ2xdd6nJ #F1 #Ferrari,ferrari remains committed to young driver support httpstcoeizxddnj f ferrari,0.1,0.4,positive,"['ferrari', 'remains', 'committed', 'to', 'young', 'driver', 'support', 'httpstcoeizxddnj', 'f', 'ferrari']","['ferrari', 'remains', 'committed', 'young', 'driver', 'support', 'httpstcoeizxddnj', 'f', 'ferrari']","['ferrari', 'remain', 'commit', 'young', 'driver', 'support', 'httpstcoeizxddnj', 'f', 'ferrari']"
186,"Ferrari's #F1 racing director, Laurent Mekies says the Italian team remains committed to its young driver initiative despite the fall-out over the Oscar Piastri saga.

https://t.co/8hcWoieXe3 https://t.co/G5Edl7r5St","ferraris f racing director laurent mekies says the italian team remains committed to its young driver initiative despite the fallout over the oscar piastri saga

httpstcohcwoiexe httpstcogedlrst",0.05,0.2,positive,"['ferraris', 'f', 'racing', 'director', 'laurent', 'mekies', 'says', 'the', 'italian', 'team', 'remains', 'committed', 'to', 'its', 'young', 'driver', 'initiative', 'despite', 'the', 'fallout', 'over', 'the', 'oscar', 'piastri', 'saga', 'httpstcohcwoiexe', 'httpstcogedlrst']","['ferraris', 'f', 'racing', 'director', 'laurent', 'mekies', 'says', 'italian', 'team', 'remains', 'committed', 'young', 'driver', 'initiative', 'despite', 'fallout', 'oscar', 'piastri', 'saga', 'httpstcohcwoiexe', 'httpstcogedlrst']","['ferrari', 'f', 'race', 'director', 'laurent', 'meki', 'say', 'italian', 'team', 'remain', 'commit', 'young', 'driver', 'initi', 'despit', 'fallout', 'oscar', 'piastri', 'saga', 'httpstcohcwoiex', 'httpstcogedlrst']"
187,i wore my ferrari jacket to uni today and this boy with a mercedes' f1 shirt winked at me lmao,i wore my ferrari jacket to uni today and this boy with a mercedes f shirt winked at me lmao,0.6,1.0,positive,"['i', 'wore', 'my', 'ferrari', 'jacket', 'to', 'uni', 'today', 'and', 'this', 'boy', 'with', 'a', 'mercedes', 'f', 'shirt', 'winked', 'at', 'me', 'lmao']","['wore', 'ferrari', 'jacket', 'uni', 'today', 'boy', 'mercedes', 'f', 'shirt', 'winked', 'lmao']","['wore', 'ferrari', 'jacket', 'uni', 'today', 'boy', 'merced', 'f', 'shirt', 'wink', 'lmao']"
188,@CoraMcNabb @f1_headassery i chose ferrari and haas,coramcnabb fheadassery i chose ferrari and haas,0.0,0.0,neutral,"['coramcnabb', 'fheadassery', 'i', 'chose', 'ferrari', 'and', 'haas']","['coramcnabb', 'fheadassery', 'chose', 'ferrari', 'haas']","['coramcnabb', 'fheadasseri', 'chose', 'ferrari', 'haa']"
189,Todt plays down rumours of Ferrari return https://t.co/6uO2E2IYbB https://t.co/aSC6MTLMM5 🏎 #f1 #formula1,todt plays down rumours of ferrari return httpstcouoeiybb httpstcoascmtlmm 🏎 f formula,-0.15555555555555559,0.2888888888888889,positive,"['todt', 'plays', 'down', 'rumours', 'of', 'ferrari', 'return', 'httpstcouoeiybb', 'httpstcoascmtlmm', 'f', 'formula']","['todt', 'plays', 'rumours', 'ferrari', 'return', 'httpstcouoeiybb', 'httpstcoascmtlmm', 'f', 'formula']","['todt', 'play', 'rumour', 'ferrari', 'return', 'httpstcouoeiybb', 'httpstcoascmtlmm', 'f', 'formula']"
190,"F1: Todt to return to Ferrari and replace Binotto - https://t.co/dwC1eaKHoY
(GMM) Former FIA president Jean Todt has played down rumors that he might be poised to return to Ferrari.
Prior to heading Formula 1’s governing body, the now 76-year-old Frenchman was the ultra-succe... https://t.co/Iqnka55Y0d","f todt to return to ferrari and replace binotto  httpstcodwceakhoy
gmm former fia president jean todt has played down rumors that he might be poised to return to ferrari
prior to heading formula ’s governing body the now yearold frenchman was the ultrasucce httpstcoiqnkayd",-0.051851851851851864,0.09629629629629631,positive,"['f', 'todt', 'to', 'return', 'to', 'ferrari', 'and', 'replace', 'binotto', 'httpstcodwceakhoy', 'gmm', 'former', 'fia', 'president', 'jean', 'todt', 'has', 'played', 'down', 'rumors', 'that', 'he', 'might', 'be', 'poised', 'to', 'return', 'to', 'ferrari', 'prior', 'to', 'heading', 'formula', 's', 'governing', 'body', 'the', 'now', 'yearold', 'frenchman', 'was', 'the', 'ultrasucce', 'httpstcoiqnkayd']","['f', 'todt', 'return', 'ferrari', 'replace', 'binotto', 'httpstcodwceakhoy', 'gmm', 'former', 'fia', 'president', 'jean', 'todt', 'played', 'rumors', 'might', 'poised', 'return', 'ferrari', 'prior', 'heading', 'formula', 'governing', 'body', 'yearold', 'frenchman', 'ultrasucce', 'httpstcoiqnkayd']","['f', 'todt', 'return', 'ferrari', 'replac', 'binotto', 'httpstcodwceakhoy', 'gmm', 'former', 'fia', 'presid', 'jean', 'todt', 'play', 'rumor', 'might', 'pois', 'return', 'ferrari', 'prior', 'head', 'formula', 'govern', 'bodi', 'yearold', 'frenchman', 'ultrasucc', 'httpstcoiqnkayd']"
191,Todt plays down rumours of Ferrari return - https://t.co/9vlomYRYgw #F1,todt plays down rumours of ferrari return  httpstcovlomyrygw f,-0.15555555555555559,0.2888888888888889,positive,"['todt', 'plays', 'down', 'rumours', 'of', 'ferrari', 'return', 'httpstcovlomyrygw', 'f']","['todt', 'plays', 'rumours', 'ferrari', 'return', 'httpstcovlomyrygw', 'f']","['todt', 'play', 'rumour', 'ferrari', 'return', 'httpstcovlomyrygw', 'f']"
192,i want f1 ferrari merch so bad,i want f ferrari merch so bad,-0.6999999999999998,0.6666666666666666,negative,"['i', 'want', 'f', 'ferrari', 'merch', 'so', 'bad']","['want', 'f', 'ferrari', 'merch', 'bad']","['want', 'f', 'ferrari', 'merch', 'bad']"
193,"Todt: Great champion Leclerc still ‘lacks something’
 
Full story 👉 https://t.co/1YLvmmzq35
 
#F1 #Ferrari #Leclerc #Todt
https://t.co/1YLvmmzq35","todt great champion leclerc still ‘lacks something’
 
full story 👉 httpstcoylvmmzq
 
f ferrari leclerc todt
httpstcoylvmmzq",0.575,0.65,positive,"['todt', 'great', 'champion', 'leclerc', 'still', 'lacks', 'something', 'full', 'story', 'httpstcoylvmmzq', 'f', 'ferrari', 'leclerc', 'todt', 'httpstcoylvmmzq']","['todt', 'great', 'champion', 'leclerc', 'still', 'lacks', 'something', 'full', 'story', 'httpstcoylvmmzq', 'f', 'ferrari', 'leclerc', 'todt', 'httpstcoylvmmzq']","['todt', 'great', 'champion', 'leclerc', 'still', 'lack', 'someth', 'full', 'stori', 'httpstcoylvmmzq', 'f', 'ferrari', 'leclerc', 'todt', 'httpstcoylvmmzq']"
194,@formularacers_ Haas biggest Clown Show in F1. They just dont get as much attention as Ferrari cause they are so bad,formularacers haas biggest clown show in f they just dont get as much attention as ferrari cause they are so bad,-0.24999999999999992,0.43333333333333335,negative,"['formularacers', 'haas', 'biggest', 'clown', 'show', 'in', 'f', 'they', 'just', 'dont', 'get', 'as', 'much', 'attention', 'as', 'ferrari', 'cause', 'they', 'are', 'so', 'bad']","['formularacers', 'haas', 'biggest', 'clown', 'show', 'f', 'dont', 'get', 'much', 'attention', 'ferrari', 'cause', 'bad']","['formularac', 'haa', 'biggest', 'clown', 'show', 'f', 'dont', 'get', 'much', 'attent', 'ferrari', 'caus', 'bad']"
195,"😡 ""Ferrari are punching the tyres!""

😩 ""It's happened again at Ferrari!""

A VERY chaotic pit-stop for Felipe Massa cost him the lead of the 2008 Singapore Grand Prix 😱

#SingaporeGP #F1 

https://t.co/6YiG3twdmv","😡 ferrari are punching the tyres

😩 its happened again at ferrari

a very chaotic pitstop for felipe massa cost him the lead of the  singapore grand prix 😱

singaporegp f 

httpstcoyigtwdmv",0.35,0.65,negative,"['', 'ferrari', 'are', 'punching', 'the', 'tyres', 'its', 'happened', 'again', 'at', 'ferrari', 'a', 'very', 'chaotic', 'pitstop', 'for', 'felipe', 'massa', 'cost', 'him', 'the', 'lead', 'of', 'the', 'singapore', 'grand', 'prix', 'singaporegp', 'f', 'httpstcoyigtwdmv']","['', 'ferrari', 'punching', 'tyres', 'happened', 'ferrari', 'chaotic', 'pitstop', 'felipe', 'massa', 'cost', 'lead', 'singapore', 'grand', 'prix', 'singaporegp', 'f', 'httpstcoyigtwdmv']","['', 'ferrari', 'punch', 'tyre', 'happen', 'ferrari', 'chaotic', 'pitstop', 'felip', 'massa', 'cost', 'lead', 'singapor', 'grand', 'prix', 'singaporegp', 'f', 'httpstcoyigtwdmv']"
196,Ferrari is their own enemy cos wtf?😂😂 https://t.co/CYYKEhFCZ0,ferrari is their own enemy cos wtf😂😂 httpstcocyykehfcz,0.6,1.0,negative,"['ferrari', 'is', 'their', 'own', 'enemy', 'cos', 'wtf', 'httpstcocyykehfcz']","['ferrari', 'enemy', 'cos', 'wtf', 'httpstcocyykehfcz']","['ferrari', 'enemi', 'co', 'wtf', 'httpstcocyykehfcz']"
