,0,text,polarity,subjectivity,sentiment,tokenized,nonstop,stemmed
81,"@CameronChesters @RhysBenjamin @xboxgiveawayz1 @F1 Fixing the race penalised Massa who was leading it. Lead to a rushed pit and a disaster.
Did ferrari fuck up? Yes. After the fact the race was manipulated to suit Renault.
Keep defending race fixing though","cameronchesters rhysbenjamin xboxgiveawayz f fixing the race penalised massa who was leading it lead to a rushed pit and a disaster
did ferrari fuck up yes after the fact the race was manipulated to suit renault
keep defending race fixing though",-0.4,0.6,negative,"['cameronchesters', 'rhysbenjamin', 'xboxgiveawayz', 'f', 'fixing', 'the', 'race', 'penalised', 'massa', 'who', 'was', 'leading', 'it', 'lead', 'to', 'a', 'rushed', 'pit', 'and', 'a', 'disaster', 'did', 'ferrari', 'fuck', 'up', 'yes', 'after', 'the', 'fact', 'the', 'race', 'was', 'manipulated', 'to', 'suit', 'renault', 'keep', 'defending', 'race', 'fixing', 'though']","['cameronchesters', 'rhysbenjamin', 'xboxgiveawayz', 'f', 'fixing', 'race', 'penalised', 'massa', 'leading', 'lead', 'rushed', 'pit', 'disaster', 'ferrari', 'fuck', 'yes', 'fact', 'race', 'manipulated', 'suit', 'renault', 'keep', 'defending', 'race', 'fixing', 'though']","['cameronchest', 'rhysbenjamin', 'xboxgiveawayz', 'f', 'fix', 'race', 'penalis', 'massa', 'lead', 'lead', 'rush', 'pit', 'disast', 'ferrari', 'fuck', 'ye', 'fact', 'race', 'manipul', 'suit', 'renault', 'keep', 'defend', 'race', 'fix', 'though']"
82,"@justin_arnold @SkySportsF1 @F1 As they arranged during 2014-2020 for Mercedes and LH..
And during the Schumacher period it was Ferrari International Assistance…
Pfff, crawl out of your cocoon man….🤦🏻‍♂️","justinarnold skysportsf f as they arranged during  for mercedes and lh
and during the schumacher period it was ferrari international assistance…
pfff crawl out of your cocoon man…🤦🏻‍♂️",0.0,0.0,neutral,"['justinarnold', 'skysportsf', 'f', 'as', 'they', 'arranged', 'during', 'for', 'mercedes', 'and', 'lh', 'and', 'during', 'the', 'schumacher', 'period', 'it', 'was', 'ferrari', 'international', 'assistance', 'pfff', 'crawl', 'out', 'of', 'your', 'cocoon', 'man', '']","['justinarnold', 'skysportsf', 'f', 'arranged', 'mercedes', 'lh', 'schumacher', 'period', 'ferrari', 'international', 'assistance', 'pfff', 'crawl', 'cocoon', 'man', '']","['justinarnold', 'skysportsf', 'f', 'arrang', 'merced', 'lh', 'schumach', 'period', 'ferrari', 'intern', 'assist', 'pfff', 'crawl', 'cocoon', 'man', '']"
83,"Todt explains what Ferrari need to achieve success 
September 26, 2022 at 03:30PM 
RacingNews365
Michael Butterworth
https://t.co/NCk1yyD8aI 

#F1 #CharlesLeclerc #CarlosSainz #ScuderiaFerrari #MattiaBinotto https://t.co/GZUgCExwrO","todt explains what ferrari need to achieve success 
september   at pm 
racingnews
michael butterworth
httpstconckyydai 

f charlesleclerc carlossainz scuderiaferrari mattiabinotto httpstcogzugcexwro",0.3,0.0,positive,"['todt', 'explains', 'what', 'ferrari', 'need', 'to', 'achieve', 'success', 'september', 'at', 'pm', 'racingnews', 'michael', 'butterworth', 'httpstconckyydai', 'f', 'charlesleclerc', 'carlossainz', 'scuderiaferrari', 'mattiabinotto', 'httpstcogzugcexwro']","['todt', 'explains', 'ferrari', 'need', 'achieve', 'success', 'september', 'pm', 'racingnews', 'michael', 'butterworth', 'httpstconckyydai', 'f', 'charlesleclerc', 'carlossainz', 'scuderiaferrari', 'mattiabinotto', 'httpstcogzugcexwro']","['todt', 'explain', 'ferrari', 'need', 'achiev', 'success', 'septemb', 'pm', 'racingnew', 'michael', 'butterworth', 'httpstconckyydai', 'f', 'charlesleclerc', 'carlossainz', 'scuderiaferrari', 'mattiabinotto', 'httpstcogzugcexwro']"
84,"@Paulkf22 @RhysBenjamin @xboxgiveawayz1 @F1 Ferrari's fault Massa's hose went with him. (Same situation for everyone making the stop)
Masi's fault for him tearing up the rulebook. 

Like I said, Alonso and Renault should have been DQ'd from that race and EVERYONE move up one place.

The last 2 laps of AD should.....","paulkf rhysbenjamin xboxgiveawayz f ferraris fault massas hose went with him same situation for everyone making the stop
masis fault for him tearing up the rulebook 

like i said alonso and renault should have been dqd from that race and everyone move up one place

the last  laps of ad should",0.0,0.09583333333333333,negative,"['paulkf', 'rhysbenjamin', 'xboxgiveawayz', 'f', 'ferraris', 'fault', 'massas', 'hose', 'went', 'with', 'him', 'same', 'situation', 'for', 'everyone', 'making', 'the', 'stop', 'masis', 'fault', 'for', 'him', 'tearing', 'up', 'the', 'rulebook', 'like', 'i', 'said', 'alonso', 'and', 'renault', 'should', 'have', 'been', 'dqd', 'from', 'that', 'race', 'and', 'everyone', 'move', 'up', 'one', 'place', 'the', 'last', 'laps', 'of', 'ad', 'should']","['paulkf', 'rhysbenjamin', 'xboxgiveawayz', 'f', 'ferraris', 'fault', 'massas', 'hose', 'went', 'situation', 'everyone', 'making', 'stop', 'masis', 'fault', 'tearing', 'rulebook', 'like', 'said', 'alonso', 'renault', 'dqd', 'race', 'everyone', 'move', 'one', 'place', 'last', 'laps', 'ad']","['paulkf', 'rhysbenjamin', 'xboxgiveawayz', 'f', 'ferrari', 'fault', 'massa', 'hose', 'went', 'situat', 'everyon', 'make', 'stop', 'masi', 'fault', 'tear', 'rulebook', 'like', 'said', 'alonso', 'renault', 'dqd', 'race', 'everyon', 'move', 'one', 'place', 'last', 'lap', 'ad']"
85,@dropball007 @Planet_F1 @LewisHamilton @LandoNorris @nyckdevries @danielricciardo @OscarPiastri @GeorgeRussell63 @CroftyF1 @Carlossainz55 @ScuderiaFerrari @Ferrari @Charles_Leclerc Have fun trolling mate 😂,dropball planetf lewishamilton landonorris nyckdevries danielricciardo oscarpiastri georgerussell croftyf carlossainz scuderiaferrari ferrari charlesleclerc have fun trolling mate 😂,0.3,0.2,positive,"['dropball', 'planetf', 'lewishamilton', 'landonorris', 'nyckdevries', 'danielricciardo', 'oscarpiastri', 'georgerussell', 'croftyf', 'carlossainz', 'scuderiaferrari', 'ferrari', 'charlesleclerc', 'have', 'fun', 'trolling', 'mate', '']","['dropball', 'planetf', 'lewishamilton', 'landonorris', 'nyckdevries', 'danielricciardo', 'oscarpiastri', 'georgerussell', 'croftyf', 'carlossainz', 'scuderiaferrari', 'ferrari', 'charlesleclerc', 'fun', 'trolling', 'mate', '']","['dropbal', 'planetf', 'lewishamilton', 'landonorri', 'nyckdevri', 'danielricciardo', 'oscarpiastri', 'georgerussel', 'croftyf', 'carlossainz', 'scuderiaferrari', 'ferrari', 'charlesleclerc', 'fun', 'troll', 'mate', '']"
86,"@CameronChesters @RhysBenjamin @xboxgiveawayz1 @F1 Ferrari's fault that Renault fixed a race.
Mercedes fault Masi fucked up.

You'll overlook the race fixing and focus on Ferrari's pit(after the crash)
Yet concentrate on Masi's decision and overlook Mercs strategy error","cameronchesters rhysbenjamin xboxgiveawayz f ferraris fault that renault fixed a race
mercedes fault masi fucked up

youll overlook the race fixing and focus on ferraris pitafter the crash
yet concentrate on masis decision and overlook mercs strategy error",-0.25,0.44999999999999996,negative,"['cameronchesters', 'rhysbenjamin', 'xboxgiveawayz', 'f', 'ferraris', 'fault', 'that', 'renault', 'fixed', 'a', 'race', 'mercedes', 'fault', 'masi', 'fucked', 'up', 'youll', 'overlook', 'the', 'race', 'fixing', 'and', 'focus', 'on', 'ferraris', 'pitafter', 'the', 'crash', 'yet', 'concentrate', 'on', 'masis', 'decision', 'and', 'overlook', 'mercs', 'strategy', 'error']","['cameronchesters', 'rhysbenjamin', 'xboxgiveawayz', 'f', 'ferraris', 'fault', 'renault', 'fixed', 'race', 'mercedes', 'fault', 'masi', 'fucked', 'youll', 'overlook', 'race', 'fixing', 'focus', 'ferraris', 'pitafter', 'crash', 'yet', 'concentrate', 'masis', 'decision', 'overlook', 'mercs', 'strategy', 'error']","['cameronchest', 'rhysbenjamin', 'xboxgiveawayz', 'f', 'ferrari', 'fault', 'renault', 'fix', 'race', 'merced', 'fault', 'masi', 'fuck', 'youll', 'overlook', 'race', 'fix', 'focu', 'ferrari', 'pitaft', 'crash', 'yet', 'concentr', 'masi', 'decis', 'overlook', 'merc', 'strategi', 'error']"
87,"Guess this driver! 🧐

PS- He's a world champion. 😉

#F1 #McLaren #Ferrari #williamsracing https://t.co/Kakan2dk1H","guess this driver 🧐

ps hes a world champion 😉

f mclaren ferrari williamsracing httpstcokakandkh",0.0,0.0,positive,"['guess', 'this', 'driver', 'ps', 'hes', 'a', 'world', 'champion', 'f', 'mclaren', 'ferrari', 'williamsracing', 'httpstcokakandkh']","['guess', 'driver', 'ps', 'hes', 'world', 'champion', 'f', 'mclaren', 'ferrari', 'williamsracing', 'httpstcokakandkh']","['guess', 'driver', 'ps', 'he', 'world', 'champion', 'f', 'mclaren', 'ferrari', 'williamsrac', 'httpstcokakandkh']"
88,"@Essere01481464 @Planet_F1 @LewisHamilton @LandoNorris @nyckdevries @danielricciardo @OscarPiastri @GeorgeRussell63 @CroftyF1 @Carlossainz55 @ScuderiaFerrari @Ferrari @Charles_Leclerc Hahahaha and where did @Charles_Leclerc get his money from? His aunt? Begging on the street corners? Come on, how low can you get to protect a spoiled brat born with a golden spoon! Really!!!!! Or will you tell lies about poverty like @LewisHamilton does?",essere planetf lewishamilton landonorris nyckdevries danielricciardo oscarpiastri georgerussell croftyf carlossainz scuderiaferrari ferrari charlesleclerc hahahaha and where did charlesleclerc get his money from his aunt begging on the street corners come on how low can you get to protect a spoiled brat born with a golden spoon really or will you tell lies about poverty like lewishamilton does,0.175,0.375,negative,"['essere', 'planetf', 'lewishamilton', 'landonorris', 'nyckdevries', 'danielricciardo', 'oscarpiastri', 'georgerussell', 'croftyf', 'carlossainz', 'scuderiaferrari', 'ferrari', 'charlesleclerc', 'hahahaha', 'and', 'where', 'did', 'charlesleclerc', 'get', 'his', 'money', 'from', 'his', 'aunt', 'begging', 'on', 'the', 'street', 'corners', 'come', 'on', 'how', 'low', 'can', 'you', 'get', 'to', 'protect', 'a', 'spoiled', 'brat', 'born', 'with', 'a', 'golden', 'spoon', 'really', 'or', 'will', 'you', 'tell', 'lies', 'about', 'poverty', 'like', 'lewishamilton', 'does']","['essere', 'planetf', 'lewishamilton', 'landonorris', 'nyckdevries', 'danielricciardo', 'oscarpiastri', 'georgerussell', 'croftyf', 'carlossainz', 'scuderiaferrari', 'ferrari', 'charlesleclerc', 'hahahaha', 'charlesleclerc', 'get', 'money', 'aunt', 'begging', 'street', 'corners', 'come', 'low', 'get', 'protect', 'spoiled', 'brat', 'born', 'golden', 'spoon', 'really', 'tell', 'lies', 'poverty', 'like', 'lewishamilton']","['esser', 'planetf', 'lewishamilton', 'landonorri', 'nyckdevri', 'danielricciardo', 'oscarpiastri', 'georgerussel', 'croftyf', 'carlossainz', 'scuderiaferrari', 'ferrari', 'charlesleclerc', 'hahahaha', 'charlesleclerc', 'get', 'money', 'aunt', 'beg', 'street', 'corner', 'come', 'low', 'get', 'protect', 'spoil', 'brat', 'born', 'golden', 'spoon', 'realli', 'tell', 'lie', 'poverti', 'like', 'lewishamilton']"
89,@Sainz55F @iam_vrda2205 @AlexChivu12 @F1 @ChrisMedlandF1 You do realise Ferrari have literally had the best car in every race pre summer break right,sainzf iamvrda alexchivu f chrismedlandf you do realise ferrari have literally had the best car in every race pre summer break right,0.6428571428571428,0.4178571428571428,positive,"['sainzf', 'iamvrda', 'alexchivu', 'f', 'chrismedlandf', 'you', 'do', 'realise', 'ferrari', 'have', 'literally', 'had', 'the', 'best', 'car', 'in', 'every', 'race', 'pre', 'summer', 'break', 'right']","['sainzf', 'iamvrda', 'alexchivu', 'f', 'chrismedlandf', 'realise', 'ferrari', 'literally', 'best', 'car', 'every', 'race', 'pre', 'summer', 'break', 'right']","['sainzf', 'iamvrda', 'alexchivu', 'f', 'chrismedlandf', 'realis', 'ferrari', 'liter', 'best', 'car', 'everi', 'race', 'pre', 'summer', 'break', 'right']"
90,@F1 You can’t make up this shit when it comes to Ferrari and Williams,f you can’t make up this shit when it comes to ferrari and williams,-0.2,0.8,negative,"['f', 'you', 'can', 't', 'make', 'up', 'this', 'shit', 'when', 'it', 'comes', 'to', 'ferrari', 'and', 'williams']","['f', 'make', 'shit', 'comes', 'ferrari', 'williams']","['f', 'make', 'shit', 'come', 'ferrari', 'william']"
91,"Hello f1 moots, what is a good birthday gift for a Ferrari fan?",hello f moots what is a good birthday gift for a ferrari fan,0.7,0.6000000000000001,positive,"['hello', 'f', 'moots', 'what', 'is', 'a', 'good', 'birthday', 'gift', 'for', 'a', 'ferrari', 'fan']","['hello', 'f', 'moots', 'good', 'birthday', 'gift', 'ferrari', 'fan']","['hello', 'f', 'moot', 'good', 'birthday', 'gift', 'ferrari', 'fan']"
92,"@deephhcrypto @ShiLLin_ViLLian Appreciate the sentiment, but wheels on a Ferrari ain't bullish at all if you've been watching F1 this season",deephhcrypto shillinvillian appreciate the sentiment but wheels on a ferrari aint bullish at all if youve been watching f this season,0.0,0.0,positive,"['deephhcrypto', 'shillinvillian', 'appreciate', 'the', 'sentiment', 'but', 'wheels', 'on', 'a', 'ferrari', 'aint', 'bullish', 'at', 'all', 'if', 'youve', 'been', 'watching', 'f', 'this', 'season']","['deephhcrypto', 'shillinvillian', 'appreciate', 'sentiment', 'wheels', 'ferrari', 'aint', 'bullish', 'youve', 'watching', 'f', 'season']","['deephhcrypto', 'shillinvillian', 'appreci', 'sentiment', 'wheel', 'ferrari', 'aint', 'bullish', 'youv', 'watch', 'f', 'season']"
93,@dropball007 @Planet_F1 @LewisHamilton @LandoNorris @nyckdevries @danielricciardo @OscarPiastri @GeorgeRussell63 @CroftyF1 @Carlossainz55 @ScuderiaFerrari @Ferrari @Charles_Leclerc Every driver makes mistakes it happens but the team make countless mistakes in every race. Anyway I wouldn't talk about overhyped drivers if I were you especially when you support sainz 🤣 guys been living off his dad's name for years,dropball planetf lewishamilton landonorris nyckdevries danielricciardo oscarpiastri georgerussell croftyf carlossainz scuderiaferrari ferrari charlesleclerc every driver makes mistakes it happens but the team make countless mistakes in every race anyway i wouldnt talk about overhyped drivers if i were you especially when you support sainz 🤣 guys been living off his dads name for years,0.0,0.75,negative,"['dropball', 'planetf', 'lewishamilton', 'landonorris', 'nyckdevries', 'danielricciardo', 'oscarpiastri', 'georgerussell', 'croftyf', 'carlossainz', 'scuderiaferrari', 'ferrari', 'charlesleclerc', 'every', 'driver', 'makes', 'mistakes', 'it', 'happens', 'but', 'the', 'team', 'make', 'countless', 'mistakes', 'in', 'every', 'race', 'anyway', 'i', 'wouldnt', 'talk', 'about', 'overhyped', 'drivers', 'if', 'i', 'were', 'you', 'especially', 'when', 'you', 'support', 'sainz', 'guys', 'been', 'living', 'off', 'his', 'dads', 'name', 'for', 'years']","['dropball', 'planetf', 'lewishamilton', 'landonorris', 'nyckdevries', 'danielricciardo', 'oscarpiastri', 'georgerussell', 'croftyf', 'carlossainz', 'scuderiaferrari', 'ferrari', 'charlesleclerc', 'every', 'driver', 'makes', 'mistakes', 'happens', 'team', 'make', 'countless', 'mistakes', 'every', 'race', 'anyway', 'wouldnt', 'talk', 'overhyped', 'drivers', 'especially', 'support', 'sainz', 'guys', 'living', 'dads', 'name', 'years']","['dropbal', 'planetf', 'lewishamilton', 'landonorri', 'nyckdevri', 'danielricciardo', 'oscarpiastri', 'georgerussel', 'croftyf', 'carlossainz', 'scuderiaferrari', 'ferrari', 'charlesleclerc', 'everi', 'driver', 'make', 'mistak', 'happen', 'team', 'make', 'countless', 'mistak', 'everi', 'race', 'anyway', 'wouldnt', 'talk', 'overhyp', 'driver', 'especi', 'support', 'sainz', 'guy', 'live', 'dad', 'name', 'year']"
94,"Cancion: The weeknd- Starboy
Peli: Ford v Ferrari
Color: Naranja
Serie: Moonknight
Estacion: invierno
Juego: Spiderman Shattered dimensions, F1 2020
Pais: Italia 🤌
Bebida: Cafe https://t.co/grojeg4JY1","cancion the weeknd starboy
peli ford v ferrari
color naranja
serie moonknight
estacion invierno
juego spiderman shattered dimensions f 
pais italia 🤌
bebida cafe httpstcogrojegjy",0.0,0.0,negative,"['cancion', 'the', 'weeknd', 'starboy', 'peli', 'ford', 'v', 'ferrari', 'color', 'naranja', 'serie', 'moonknight', 'estacion', 'invierno', 'juego', 'spiderman', 'shattered', 'dimensions', 'f', 'pais', 'italia', 'bebida', 'cafe', 'httpstcogrojegjy']","['cancion', 'weeknd', 'starboy', 'peli', 'ford', 'v', 'ferrari', 'color', 'naranja', 'serie', 'moonknight', 'estacion', 'invierno', 'juego', 'spiderman', 'shattered', 'dimensions', 'f', 'pais', 'italia', 'bebida', 'cafe', 'httpstcogrojegjy']","['cancion', 'weeknd', 'starboy', 'peli', 'ford', 'v', 'ferrari', 'color', 'naranja', 'seri', 'moonknight', 'estacion', 'invierno', 'juego', 'spiderman', 'shatter', 'dimens', 'f', 'pai', 'italia', 'bebida', 'cafe', 'httpstcogrojegji']"
95,"‼️ Get your officially licensed Charles jersey 😍⤵️🏎👇

https://t.co/RAnxZbgHgm","‼️ get your officially licensed charles jersey 😍⤵️🏎👇

httpstcoranxzbghgm",0.0,0.0,neutral,"['', 'get', 'your', 'officially', 'licensed', 'charles', 'jersey', 'httpstcoranxzbghgm']","['', 'get', 'officially', 'licensed', 'charles', 'jersey', 'httpstcoranxzbghgm']","['', 'get', 'offici', 'licens', 'charl', 'jersey', 'httpstcoranxzbghgm']"
96,"@Paulkf22 @RhysBenjamin @xboxgiveawayz1 @F1 Yes Piquet caused the crash. But he didn't cause Ferrari to fuck up Massa's stop. That was ALL on Ferrari, not Nelson. And no, what SHOULD have happened was Alonso and Renault DQ'd from the results and everybody move up a place as a result, since it was meant to only benefit ALO.",paulkf rhysbenjamin xboxgiveawayz f yes piquet caused the crash but he didnt cause ferrari to fuck up massas stop that was all on ferrari not nelson and no what should have happened was alonso and renault dqd from the results and everybody move up a place as a result since it was meant to only benefit alo,-0.2,0.8,negative,"['paulkf', 'rhysbenjamin', 'xboxgiveawayz', 'f', 'yes', 'piquet', 'caused', 'the', 'crash', 'but', 'he', 'didnt', 'cause', 'ferrari', 'to', 'fuck', 'up', 'massas', 'stop', 'that', 'was', 'all', 'on', 'ferrari', 'not', 'nelson', 'and', 'no', 'what', 'should', 'have', 'happened', 'was', 'alonso', 'and', 'renault', 'dqd', 'from', 'the', 'results', 'and', 'everybody', 'move', 'up', 'a', 'place', 'as', 'a', 'result', 'since', 'it', 'was', 'meant', 'to', 'only', 'benefit', 'alo']","['paulkf', 'rhysbenjamin', 'xboxgiveawayz', 'f', 'yes', 'piquet', 'caused', 'crash', 'didnt', 'cause', 'ferrari', 'fuck', 'massas', 'stop', 'ferrari', 'nelson', 'happened', 'alonso', 'renault', 'dqd', 'results', 'everybody', 'move', 'place', 'result', 'since', 'meant', 'benefit', 'alo']","['paulkf', 'rhysbenjamin', 'xboxgiveawayz', 'f', 'ye', 'piquet', 'caus', 'crash', 'didnt', 'caus', 'ferrari', 'fuck', 'massa', 'stop', 'ferrari', 'nelson', 'happen', 'alonso', 'renault', 'dqd', 'result', 'everybodi', 'move', 'place', 'result', 'sinc', 'meant', 'benefit', 'alo']"
97,Red Bull's Perez defends frequency of Ferrari F1 mistakes #GrandPrix #GPToday #Formula1 #F1 #F1News #Motorsport https://t.co/4ddHjEFrJb,red bulls perez defends frequency of ferrari f mistakes grandprix gptoday formula f fnews motorsport httpstcoddhjefrjb,0.0,0.0,negative,"['red', 'bulls', 'perez', 'defends', 'frequency', 'of', 'ferrari', 'f', 'mistakes', 'grandprix', 'gptoday', 'formula', 'f', 'fnews', 'motorsport', 'httpstcoddhjefrjb']","['red', 'bulls', 'perez', 'defends', 'frequency', 'ferrari', 'f', 'mistakes', 'grandprix', 'gptoday', 'formula', 'f', 'fnews', 'motorsport', 'httpstcoddhjefrjb']","['red', 'bull', 'perez', 'defend', 'frequenc', 'ferrari', 'f', 'mistak', 'grandprix', 'gptoday', 'formula', 'f', 'fnew', 'motorsport', 'httpstcoddhjefrjb']"
98,Ex-Ferrari Boss Says Leclerc Is “Lacking Something” In His First F1 Title Battle https://t.co/UA2jahgGBB,exferrari boss says leclerc is “lacking something” in his first f title battle httpstcouajahggbb,0.25,0.3333333333333333,negative,"['exferrari', 'boss', 'says', 'leclerc', 'is', 'lacking', 'something', 'in', 'his', 'first', 'f', 'title', 'battle', 'httpstcouajahggbb']","['exferrari', 'boss', 'says', 'leclerc', 'lacking', 'something', 'first', 'f', 'title', 'battle', 'httpstcouajahggbb']","['exferrari', 'boss', 'say', 'leclerc', 'lack', 'someth', 'first', 'f', 'titl', 'battl', 'httpstcouajahggbb']"
99,"I like Günther and not the biggest fan of Mick, but Haas is somehow a bigger circus than Ferrari. Hope Porsche buy them ngl. 

#F1 #SingaporeAirlines #SingaporeGP https://t.co/WpJw9V2lom","i like günther and not the biggest fan of mick but haas is somehow a bigger circus than ferrari hope porsche buy them ngl 

f singaporeairlines singaporegp httpstcowpjwvlom",0.0,0.5,positive,"['i', 'like', 'günther', 'and', 'not', 'the', 'biggest', 'fan', 'of', 'mick', 'but', 'haas', 'is', 'somehow', 'a', 'bigger', 'circus', 'than', 'ferrari', 'hope', 'porsche', 'buy', 'them', 'ngl', 'f', 'singaporeairlines', 'singaporegp', 'httpstcowpjwvlom']","['like', 'günther', 'biggest', 'fan', 'mick', 'haas', 'somehow', 'bigger', 'circus', 'ferrari', 'hope', 'porsche', 'buy', 'ngl', 'f', 'singaporeairlines', 'singaporegp', 'httpstcowpjwvlom']","['like', 'günther', 'biggest', 'fan', 'mick', 'haa', 'somehow', 'bigger', 'circu', 'ferrari', 'hope', 'porsch', 'buy', 'ngl', 'f', 'singaporeairlin', 'singaporegp', 'httpstcowpjwvlom']"
100,@MikeTan73 @StathisTsk @bdotsenol @F1 it means u weren't watching any interviews or press conferences then because in Ferrari (and in RB too sometimes) Seb usually blamed himself,miketan stathistsk bdotsenol f it means u werent watching any interviews or press conferences then because in ferrari and in rb too sometimes seb usually blamed himself,-0.25,0.25,negative,"['miketan', 'stathistsk', 'bdotsenol', 'f', 'it', 'means', 'u', 'werent', 'watching', 'any', 'interviews', 'or', 'press', 'conferences', 'then', 'because', 'in', 'ferrari', 'and', 'in', 'rb', 'too', 'sometimes', 'seb', 'usually', 'blamed', 'himself']","['miketan', 'stathistsk', 'bdotsenol', 'f', 'means', 'u', 'werent', 'watching', 'interviews', 'press', 'conferences', 'ferrari', 'rb', 'sometimes', 'seb', 'usually', 'blamed']","['miketan', 'stathistsk', 'bdotsenol', 'f', 'mean', 'u', 'werent', 'watch', 'interview', 'press', 'confer', 'ferrari', 'rb', 'sometim', 'seb', 'usual', 'blame']"
101,"Speaking of Ferrari, you seem to be in the midst of suffering again.

Brawn: Yes, they are frustrated. The positive thing is that they basically have a car that you can drive up front. But let me put it this way: They often acted unhappily. 

F1-Insider","speaking of ferrari you seem to be in the midst of suffering again

brawn yes they are frustrated the positive thing is that they basically have a car that you can drive up front but let me put it this way they often acted unhappily 

finsider",-0.3575757575757576,0.5484848484848485,negative,"['speaking', 'of', 'ferrari', 'you', 'seem', 'to', 'be', 'in', 'the', 'midst', 'of', 'suffering', 'again', 'brawn', 'yes', 'they', 'are', 'frustrated', 'the', 'positive', 'thing', 'is', 'that', 'they', 'basically', 'have', 'a', 'car', 'that', 'you', 'can', 'drive', 'up', 'front', 'but', 'let', 'me', 'put', 'it', 'this', 'way', 'they', 'often', 'acted', 'unhappily', 'finsider']","['speaking', 'ferrari', 'seem', 'midst', 'suffering', 'brawn', 'yes', 'frustrated', 'positive', 'thing', 'basically', 'car', 'drive', 'front', 'let', 'put', 'way', 'often', 'acted', 'unhappily', 'finsider']","['speak', 'ferrari', 'seem', 'midst', 'suffer', 'brawn', 'ye', 'frustrat', 'posit', 'thing', 'basic', 'car', 'drive', 'front', 'let', 'put', 'way', 'often', 'act', 'unhappili', 'finsid']"
102,"@pitstopfracas F1 without Italy will be F1 without Ferrari and at the point that happens, F1 will cease to exist.",pitstopfracas f without italy will be f without ferrari and at the point that happens f will cease to exist,0.0,0.0,neutral,"['pitstopfracas', 'f', 'without', 'italy', 'will', 'be', 'f', 'without', 'ferrari', 'and', 'at', 'the', 'point', 'that', 'happens', 'f', 'will', 'cease', 'to', 'exist']","['pitstopfracas', 'f', 'without', 'italy', 'f', 'without', 'ferrari', 'point', 'happens', 'f', 'cease', 'exist']","['pitstopfraca', 'f', 'without', 'itali', 'f', 'without', 'ferrari', 'point', 'happen', 'f', 'ceas', 'exist']"
103,"Mick Schumacher inherited one major trait from dad Michael, claims ex-Ferrari boss
https://t.co/MMyOsGmjTZ","mick schumacher inherited one major trait from dad michael claims exferrari boss
httpstcommyosgmjtz",0.0625,0.5,neutral,"['mick', 'schumacher', 'inherited', 'one', 'major', 'trait', 'from', 'dad', 'michael', 'claims', 'exferrari', 'boss', 'httpstcommyosgmjtz']","['mick', 'schumacher', 'inherited', 'one', 'major', 'trait', 'dad', 'michael', 'claims', 'exferrari', 'boss', 'httpstcommyosgmjtz']","['mick', 'schumach', 'inherit', 'one', 'major', 'trait', 'dad', 'michael', 'claim', 'exferrari', 'boss', 'httpstcommyosgmjtz']"
104,"Lewis Hamilton, Dethroned By Max Verstappen, Disregards the Reigning F1 Champ as a Worthy Successor https://t.co/ILx5SWeoGq #F1 #Ferrari",lewis hamilton dethroned by max verstappen disregards the reigning f champ as a worthy successor httpstcoilxsweogq f ferrari,0.3333333333333333,1.0,positive,"['lewis', 'hamilton', 'dethroned', 'by', 'max', 'verstappen', 'disregards', 'the', 'reigning', 'f', 'champ', 'as', 'a', 'worthy', 'successor', 'httpstcoilxsweogq', 'f', 'ferrari']","['lewis', 'hamilton', 'dethroned', 'max', 'verstappen', 'disregards', 'reigning', 'f', 'champ', 'worthy', 'successor', 'httpstcoilxsweogq', 'f', 'ferrari']","['lewi', 'hamilton', 'dethron', 'max', 'verstappen', 'disregard', 'reign', 'f', 'champ', 'worthi', 'successor', 'httpstcoilxsweogq', 'f', 'ferrari']"
