,0,text,polarity,subjectivity,sentiment,tokenized,nonstop,stemmed
0,"*female f1 fans reposting shirtless driver pics* -disgusting, sexualizing the driver, only likes the sport for the looks

*Ferrari admin posting ABSOLUTE THIRST TRAPS OF THE DRIVERS SHIRTLESS* - respect ✊🏼 

Make it make sense. Even Ferrari admin is living the best of both worlds","female f fans reposting shirtless driver pics disgusting sexualizing the driver only likes the sport for the looks

ferrari admin posting absolute thirst traps of the drivers shirtless  respect ✊🏼 

make it make sense even ferrari admin is living the best of both worlds",0.039999999999999994,0.6733333333333333,positive,"['female', 'f', 'fans', 'reposting', 'shirtless', 'driver', 'pics', 'disgusting', 'sexualizing', 'the', 'driver', 'only', 'likes', 'the', 'sport', 'for', 'the', 'looks', 'ferrari', 'admin', 'posting', 'absolute', 'thirst', 'traps', 'of', 'the', 'drivers', 'shirtless', 'respect', 'make', 'it', 'make', 'sense', 'even', 'ferrari', 'admin', 'is', 'living', 'the', 'best', 'of', 'both', 'worlds']","['female', 'f', 'fans', 'reposting', 'shirtless', 'driver', 'pics', 'disgusting', 'sexualizing', 'driver', 'likes', 'sport', 'looks', 'ferrari', 'admin', 'posting', 'absolute', 'thirst', 'traps', 'drivers', 'shirtless', 'respect', 'make', 'make', 'sense', 'even', 'ferrari', 'admin', 'living', 'best', 'worlds']","['femal', 'f', 'fan', 'repost', 'shirtless', 'driver', 'pic', 'disgust', 'sexual', 'driver', 'like', 'sport', 'look', 'ferrari', 'admin', 'post', 'absolut', 'thirst', 'trap', 'driver', 'shirtless', 'respect', 'make', 'make', 'sens', 'even', 'ferrari', 'admin', 'live', 'best', 'world']"
1,"Watch a video explaining Ferrari's development plan for 2023 🏎 Full report 👉 https://t.co/yzXdj2P3p4 ⬅️ 👀

#ScuderiaFans #ForzaFerrari #essereFerrari 🔴 #F1 https://t.co/PWGiZHtPgi","watch a video explaining ferraris development plan for  🏎 full report 👉 httpstcoyzxdjpp ⬅️ 👀

scuderiafans forzaferrari essereferrari 🔴 f httpstcopwgizhtpgi",0.35,0.55,neutral,"['watch', 'a', 'video', 'explaining', 'ferraris', 'development', 'plan', 'for', 'full', 'report', 'httpstcoyzxdjpp', 'scuderiafans', 'forzaferrari', 'essereferrari', 'f', 'httpstcopwgizhtpgi']","['watch', 'video', 'explaining', 'ferraris', 'development', 'plan', 'full', 'report', 'httpstcoyzxdjpp', 'scuderiafans', 'forzaferrari', 'essereferrari', 'f', 'httpstcopwgizhtpgi']","['watch', 'video', 'explain', 'ferrari', 'develop', 'plan', 'full', 'report', 'httpstcoyzxdjpp', 'scuderiafan', 'forzaferrari', 'essereferrari', 'f', 'httpstcopwgizhtpgi']"
2,"[Race Fans]
Ferrari engine’s driveability is biggest difference to Mercedes – Bottas | RaceFans Round-up
#F1 #ValtteriBottas #Charles_Leclerc #ScuderiaFerrari #MercedesAMGF1  #Formula1 #F1News

https://t.co/WbmuFT8sDZ","race fans
ferrari engine’s driveability is biggest difference to mercedes – bottas  racefans roundup
f valtteribottas charlesleclerc scuderiaferrari mercedesamgf  formula fnews

httpstcowbmuftsdz",0.0,0.0,neutral,"['race', 'fans', 'ferrari', 'engine', 's', 'driveability', 'is', 'biggest', 'difference', 'to', 'mercedes', 'bottas', 'racefans', 'roundup', 'f', 'valtteribottas', 'charlesleclerc', 'scuderiaferrari', 'mercedesamgf', 'formula', 'fnews', 'httpstcowbmuftsdz']","['race', 'fans', 'ferrari', 'engine', 'driveability', 'biggest', 'difference', 'mercedes', 'bottas', 'racefans', 'roundup', 'f', 'valtteribottas', 'charlesleclerc', 'scuderiaferrari', 'mercedesamgf', 'formula', 'fnews', 'httpstcowbmuftsdz']","['race', 'fan', 'ferrari', 'engin', 'driveabl', 'biggest', 'differ', 'merced', 'botta', 'racefan', 'roundup', 'f', 'valtteribotta', 'charlesleclerc', 'scuderiaferrari', 'mercedesamgf', 'formula', 'fnew', 'httpstcowbmuftsdz']"
3,Ferrari boss Binotto set for talks with Schumacher over his F1 future | Formula 1® https://t.co/z8LamZudGn,ferrari boss binotto set for talks with schumacher over his f future  formula ® httpstcozlamzudgn,0.0,0.125,neutral,"['ferrari', 'boss', 'binotto', 'set', 'for', 'talks', 'with', 'schumacher', 'over', 'his', 'f', 'future', 'formula', 'httpstcozlamzudgn']","['ferrari', 'boss', 'binotto', 'set', 'talks', 'schumacher', 'f', 'future', 'formula', 'httpstcozlamzudgn']","['ferrari', 'boss', 'binotto', 'set', 'talk', 'schumach', 'f', 'futur', 'formula', 'httpstcozlamzudgn']"
4,Leclerc: F1 world championship drought not pressuring Ferrari #GrandPrix #GPToday #Formula1 #F1 #F1News #Motorsport https://t.co/ei9FqX9EZ0,leclerc f world championship drought not pressuring ferrari grandprix gptoday formula f fnews motorsport httpstcoeifqxez,0.0,0.0,positive,"['leclerc', 'f', 'world', 'championship', 'drought', 'not', 'pressuring', 'ferrari', 'grandprix', 'gptoday', 'formula', 'f', 'fnews', 'motorsport', 'httpstcoeifqxez']","['leclerc', 'f', 'world', 'championship', 'drought', 'pressuring', 'ferrari', 'grandprix', 'gptoday', 'formula', 'f', 'fnews', 'motorsport', 'httpstcoeifqxez']","['leclerc', 'f', 'world', 'championship', 'drought', 'pressur', 'ferrari', 'grandprix', 'gptoday', 'formula', 'f', 'fnew', 'motorsport', 'httpstcoeifqxez']"
5,Shop Now: Charles Leclerc Ferrari 2022 F1 T-Shirt | 30% discount https://t.co/cc53TpLYyd,shop now charles leclerc ferrari  f tshirt   discount httpstcocctplyyd,0.0,0.0,neutral,"['shop', 'now', 'charles', 'leclerc', 'ferrari', 'f', 'tshirt', 'discount', 'httpstcocctplyyd']","['shop', 'charles', 'leclerc', 'ferrari', 'f', 'tshirt', 'discount', 'httpstcocctplyyd']","['shop', 'charl', 'leclerc', 'ferrari', 'f', 'tshirt', 'discount', 'httpstcocctplyyd']"
6,Leclerc: F1 world championship drought not pressuring Ferrari #Formula1 #F1 #F1News #Motorsport https://t.co/mwN2fmNkZY,leclerc f world championship drought not pressuring ferrari formula f fnews motorsport httpstcomwnfmnkzy,0.0,0.0,positive,"['leclerc', 'f', 'world', 'championship', 'drought', 'not', 'pressuring', 'ferrari', 'formula', 'f', 'fnews', 'motorsport', 'httpstcomwnfmnkzy']","['leclerc', 'f', 'world', 'championship', 'drought', 'pressuring', 'ferrari', 'formula', 'f', 'fnews', 'motorsport', 'httpstcomwnfmnkzy']","['leclerc', 'f', 'world', 'championship', 'drought', 'pressur', 'ferrari', 'formula', 'f', 'fnew', 'motorsport', 'httpstcomwnfmnkzi']"
7,"NEW: RaceFans Round-up - Ferrari engine’s driveability is biggest difference to Mercedes – Bottas - https://t.co/v1p3Sg94fD

By @keithcollantine

#F1","new racefans roundup  ferrari engine’s driveability is biggest difference to mercedes – bottas  httpstcovpsgfd

by keithcollantine

f",0.13636363636363635,0.45454545454545453,neutral,"['new', 'racefans', 'roundup', 'ferrari', 'engine', 's', 'driveability', 'is', 'biggest', 'difference', 'to', 'mercedes', 'bottas', 'httpstcovpsgfd', 'by', 'keithcollantine', 'f']","['new', 'racefans', 'roundup', 'ferrari', 'engine', 'driveability', 'biggest', 'difference', 'mercedes', 'bottas', 'httpstcovpsgfd', 'keithcollantine', 'f']","['new', 'racefan', 'roundup', 'ferrari', 'engin', 'driveabl', 'biggest', 'differ', 'merced', 'botta', 'httpstcovpsgfd', 'keithcollantin', 'f']"
8,@f1_historia But Ferrari drive,fhistoria but ferrari drive,0.0,0.0,neutral,"['fhistoria', 'but', 'ferrari', 'drive']","['fhistoria', 'ferrari', 'drive']","['fhistoria', 'ferrari', 'drive']"
9,@f1_sofi As a Ferrari fan my only plans for the weekend are disappointment,fsofi as a ferrari fan my only plans for the weekend are disappointment,-0.3,0.7,negative,"['fsofi', 'as', 'a', 'ferrari', 'fan', 'my', 'only', 'plans', 'for', 'the', 'weekend', 'are', 'disappointment']","['fsofi', 'ferrari', 'fan', 'plans', 'weekend', 'disappointment']","['fsofi', 'ferrari', 'fan', 'plan', 'weekend', 'disappoint']"
10,"Real exciting and competitive F1 lineup next year:

Mercedes: Hamilton &amp; Russell
Red Bull: Verstappen &amp; Perez
Ferrari: Leclerc &amp; Sainz
McLaren: Norris &amp; Piastri
Alpine: Gasly &amp; Ocon

Stacked top 5","real exciting and competitive f lineup next year

mercedes hamilton amp russell
red bull verstappen amp perez
ferrari leclerc amp sainz
mclaren norris amp piastri
alpine gasly amp ocon

stacked top ",0.2375,0.375,positive,"['real', 'exciting', 'and', 'competitive', 'f', 'lineup', 'next', 'year', 'mercedes', 'hamilton', 'amp', 'russell', 'red', 'bull', 'verstappen', 'amp', 'perez', 'ferrari', 'leclerc', 'amp', 'sainz', 'mclaren', 'norris', 'amp', 'piastri', 'alpine', 'gasly', 'amp', 'ocon', 'stacked', 'top', '']","['real', 'exciting', 'competitive', 'f', 'lineup', 'next', 'year', 'mercedes', 'hamilton', 'amp', 'russell', 'red', 'bull', 'verstappen', 'amp', 'perez', 'ferrari', 'leclerc', 'amp', 'sainz', 'mclaren', 'norris', 'amp', 'piastri', 'alpine', 'gasly', 'amp', 'ocon', 'stacked', 'top', '']","['real', 'excit', 'competit', 'f', 'lineup', 'next', 'year', 'merced', 'hamilton', 'amp', 'russel', 'red', 'bull', 'verstappen', 'amp', 'perez', 'ferrari', 'leclerc', 'amp', 'sainz', 'mclaren', 'norri', 'amp', 'piastri', 'alpin', 'gasli', 'amp', 'ocon', 'stack', 'top', '']"
11,"Michael Schumacher (Ferrari F300) on a quick lap during qualifying as the German took Pole Position.
Luxembourg GP Qualifying, Nurburgring, 26th September 1998. #F1
https://t.co/1jmr3zNbmz","michael schumacher ferrari f on a quick lap during qualifying as the german took pole position
luxembourg gp qualifying nurburgring th september  f
httpstcojmrznbmz",0.16666666666666666,0.25,neutral,"['michael', 'schumacher', 'ferrari', 'f', 'on', 'a', 'quick', 'lap', 'during', 'qualifying', 'as', 'the', 'german', 'took', 'pole', 'position', 'luxembourg', 'gp', 'qualifying', 'nurburgring', 'th', 'september', 'f', 'httpstcojmrznbmz']","['michael', 'schumacher', 'ferrari', 'f', 'quick', 'lap', 'qualifying', 'german', 'took', 'pole', 'position', 'luxembourg', 'gp', 'qualifying', 'nurburgring', 'th', 'september', 'f', 'httpstcojmrznbmz']","['michael', 'schumach', 'ferrari', 'f', 'quick', 'lap', 'qualifi', 'german', 'took', 'pole', 'posit', 'luxembourg', 'gp', 'qualifi', 'nurburgr', 'th', 'septemb', 'f', 'httpstcojmrznbmz']"
12,Ex-Ferrari boss lays out path for Ferrari success; Haas opens up on Schumacher struggles: F1 Pit Talk - Fox Sports https://t.co/UhL3lU5zYe,exferrari boss lays out path for ferrari success haas opens up on schumacher struggles f pit talk  fox sports httpstcouhlluzye,0.3,0.0,positive,"['exferrari', 'boss', 'lays', 'out', 'path', 'for', 'ferrari', 'success', 'haas', 'opens', 'up', 'on', 'schumacher', 'struggles', 'f', 'pit', 'talk', 'fox', 'sports', 'httpstcouhlluzye']","['exferrari', 'boss', 'lays', 'path', 'ferrari', 'success', 'haas', 'opens', 'schumacher', 'struggles', 'f', 'pit', 'talk', 'fox', 'sports', 'httpstcouhlluzye']","['exferrari', 'boss', 'lay', 'path', 'ferrari', 'success', 'haa', 'open', 'schumach', 'struggl', 'f', 'pit', 'talk', 'fox', 'sport', 'httpstcouhlluzy']"
13,@Citrix Virtual Lap | Max Verstappen Laps The Jeddah Corniche Circuit #DanielRicciardo #F1 #FernandoAlonso #Ferrari #FormulaOne #KimiRaikkonen #LewisHamilton #MarkWebber #MaxVerstappen #McLaren #motorsport #racing #RedBull #RedBullF1 #RedBullRacing #RedBullRedBullF1 #Sebast... https://t.co/mAdqMLFaz0,citrix virtual lap  max verstappen laps the jeddah corniche circuit danielricciardo f fernandoalonso ferrari formulaone kimiraikkonen lewishamilton markwebber maxverstappen mclaren motorsport racing redbull redbullf redbullracing redbullredbullf sebast httpstcomadqmlfaz,0.0,0.0,neutral,"['citrix', 'virtual', 'lap', 'max', 'verstappen', 'laps', 'the', 'jeddah', 'corniche', 'circuit', 'danielricciardo', 'f', 'fernandoalonso', 'ferrari', 'formulaone', 'kimiraikkonen', 'lewishamilton', 'markwebber', 'maxverstappen', 'mclaren', 'motorsport', 'racing', 'redbull', 'redbullf', 'redbullracing', 'redbullredbullf', 'sebast', 'httpstcomadqmlfaz']","['citrix', 'virtual', 'lap', 'max', 'verstappen', 'laps', 'jeddah', 'corniche', 'circuit', 'danielricciardo', 'f', 'fernandoalonso', 'ferrari', 'formulaone', 'kimiraikkonen', 'lewishamilton', 'markwebber', 'maxverstappen', 'mclaren', 'motorsport', 'racing', 'redbull', 'redbullf', 'redbullracing', 'redbullredbullf', 'sebast', 'httpstcomadqmlfaz']","['citrix', 'virtual', 'lap', 'max', 'verstappen', 'lap', 'jeddah', 'cornich', 'circuit', 'danielricciardo', 'f', 'fernandoalonso', 'ferrari', 'formulaon', 'kimiraikkonen', 'lewishamilton', 'markwebb', 'maxverstappen', 'mclaren', 'motorsport', 'race', 'redbul', 'redbullf', 'redbullrac', 'redbullredbullf', 'sebast', 'httpstcomadqmlfaz']"
14,"Meet my hobby, driver of an F1 Ferrari 643. An amazing masterpiece driven by Alain Prost and by Jean Alesi. This masterpiece art is made by @tongasterv, thank you so much for drawing this for me. https://t.co/n07eyRUI89",meet my hobby driver of an f ferrari  an amazing masterpiece driven by alain prost and by jean alesi this masterpiece art is made by tongasterv thank you so much for drawing this for me httpstconeyrui,0.4,0.55,positive,"['meet', 'my', 'hobby', 'driver', 'of', 'an', 'f', 'ferrari', 'an', 'amazing', 'masterpiece', 'driven', 'by', 'alain', 'prost', 'and', 'by', 'jean', 'alesi', 'this', 'masterpiece', 'art', 'is', 'made', 'by', 'tongasterv', 'thank', 'you', 'so', 'much', 'for', 'drawing', 'this', 'for', 'me', 'httpstconeyrui']","['meet', 'hobby', 'driver', 'f', 'ferrari', 'amazing', 'masterpiece', 'driven', 'alain', 'prost', 'jean', 'alesi', 'masterpiece', 'art', 'made', 'tongasterv', 'thank', 'much', 'drawing', 'httpstconeyrui']","['meet', 'hobbi', 'driver', 'f', 'ferrari', 'amaz', 'masterpiec', 'driven', 'alain', 'prost', 'jean', 'alesi', 'masterpiec', 'art', 'made', 'tongasterv', 'thank', 'much', 'draw', 'httpstconeyrui']"
15,@ScuderiaFerrari @F1 If only Ferrari gave a good enough team to surround him. He would’ve made wonders.,scuderiaferrari f if only ferrari gave a good enough team to surround him he would’ve made wonders,0.2333333333333333,0.7000000000000001,positive,"['scuderiaferrari', 'f', 'if', 'only', 'ferrari', 'gave', 'a', 'good', 'enough', 'team', 'to', 'surround', 'him', 'he', 'would', 've', 'made', 'wonders']","['scuderiaferrari', 'f', 'ferrari', 'gave', 'good', 'enough', 'team', 'surround', 'would', 'made', 'wonders']","['scuderiaferrari', 'f', 'ferrari', 'gave', 'good', 'enough', 'team', 'surround', 'would', 'made', 'wonder']"
16,".
🏁gilles villeneuve carlos reutemann germany 1979 #F1 🏁

Joseph Gilles Henri Villeneuve (CAN) (Scuderia #Ferrari), #Ferrari 312T4 - #Ferrari Flat-12 (finished 8th)Carlos Alberto Reutemann (ARG) (Martini Racing Team #Lotus), #Lotus 79 - #Ford-Cosworth DFV V8 (RET)1979 Germa... https://t.co/Z1YRrWOS1h","
🏁gilles villeneuve carlos reutemann germany  f 🏁

joseph gilles henri villeneuve can scuderia ferrari ferrari t  ferrari flat finished thcarlos alberto reutemann arg martini racing team lotus lotus   fordcosworth dfv v ret germa httpstcozyrrwosh",-0.025,0.125,neutral,"['', 'gilles', 'villeneuve', 'carlos', 'reutemann', 'germany', 'f', 'joseph', 'gilles', 'henri', 'villeneuve', 'can', 'scuderia', 'ferrari', 'ferrari', 't', 'ferrari', 'flat', 'finished', 'thcarlos', 'alberto', 'reutemann', 'arg', 'martini', 'racing', 'team', 'lotus', 'lotus', 'fordcosworth', 'dfv', 'v', 'ret', 'germa', 'httpstcozyrrwosh']","['', 'gilles', 'villeneuve', 'carlos', 'reutemann', 'germany', 'f', 'joseph', 'gilles', 'henri', 'villeneuve', 'scuderia', 'ferrari', 'ferrari', 'ferrari', 'flat', 'finished', 'thcarlos', 'alberto', 'reutemann', 'arg', 'martini', 'racing', 'team', 'lotus', 'lotus', 'fordcosworth', 'dfv', 'v', 'ret', 'germa', 'httpstcozyrrwosh']","['', 'gill', 'villeneuv', 'carlo', 'reutemann', 'germani', 'f', 'joseph', 'gill', 'henri', 'villeneuv', 'scuderia', 'ferrari', 'ferrari', 'ferrari', 'flat', 'finish', 'thcarlo', 'alberto', 'reutemann', 'arg', 'martini', 'race', 'team', 'lotu', 'lotu', 'fordcosworth', 'dfv', 'v', 'ret', 'germa', 'httpstcozyrrwosh']"
17,"Schumacher has lived an extremely private life following his accident #F1

https://t.co/o3gzTCaFbP","schumacher has lived an extremely private life following his accident f

httpstcoogztcafbp",0.0,0.2375,negative,"['schumacher', 'has', 'lived', 'an', 'extremely', 'private', 'life', 'following', 'his', 'accident', 'f', 'httpstcoogztcafbp']","['schumacher', 'lived', 'extremely', 'private', 'life', 'following', 'accident', 'f', 'httpstcoogztcafbp']","['schumach', 'live', 'extrem', 'privat', 'life', 'follow', 'accid', 'f', 'httpstcoogztcafbp']"
18,"@wtfmikey12 @Motorsport You talk sh*t. Read this: https://t.co/Jqy2XiwdsG

So Mercedes has been faster than Ferrari.","wtfmikey motorsport you talk sht read this httpstcojqyxiwdsg

so mercedes has been faster than ferrari",0.0,0.0,neutral,"['wtfmikey', 'motorsport', 'you', 'talk', 'sht', 'read', 'this', 'httpstcojqyxiwdsg', 'so', 'mercedes', 'has', 'been', 'faster', 'than', 'ferrari']","['wtfmikey', 'motorsport', 'talk', 'sht', 'read', 'httpstcojqyxiwdsg', 'mercedes', 'faster', 'ferrari']","['wtfmikey', 'motorsport', 'talk', 'sht', 'read', 'httpstcojqyxiwdsg', 'merced', 'faster', 'ferrari']"
19,Sebastian Vettel Or Ferrari for the win in Singapore #SingaporeGP #F1 https://t.co/1HEoQFkQZj,sebastian vettel or ferrari for the win in singapore singaporegp f httpstcoheoqfkqzj,0.8,0.4,positive,"['sebastian', 'vettel', 'or', 'ferrari', 'for', 'the', 'win', 'in', 'singapore', 'singaporegp', 'f', 'httpstcoheoqfkqzj']","['sebastian', 'vettel', 'ferrari', 'win', 'singapore', 'singaporegp', 'f', 'httpstcoheoqfkqzj']","['sebastian', 'vettel', 'ferrari', 'win', 'singapor', 'singaporegp', 'f', 'httpstcoheoqfkqzj']"
20,Ex-Ferrari boss lays out path for Ferrari success; Haas opens up on Schumacher struggles: F1 Pit Talk https://t.co/FlovwPb7Ae [via @FOXSportsAUS] https://t.co/igbw8rsMp8,exferrari boss lays out path for ferrari success haas opens up on schumacher struggles f pit talk httpstcoflovwpbae via foxsportsaus httpstcoigbwrsmp,0.3,0.0,positive,"['exferrari', 'boss', 'lays', 'out', 'path', 'for', 'ferrari', 'success', 'haas', 'opens', 'up', 'on', 'schumacher', 'struggles', 'f', 'pit', 'talk', 'httpstcoflovwpbae', 'via', 'foxsportsaus', 'httpstcoigbwrsmp']","['exferrari', 'boss', 'lays', 'path', 'ferrari', 'success', 'haas', 'opens', 'schumacher', 'struggles', 'f', 'pit', 'talk', 'httpstcoflovwpbae', 'via', 'foxsportsaus', 'httpstcoigbwrsmp']","['exferrari', 'boss', 'lay', 'path', 'ferrari', 'success', 'haa', 'open', 'schumach', 'struggl', 'f', 'pit', 'talk', 'httpstcoflovwpba', 'via', 'foxsportsau', 'httpstcoigbwrsmp']"
21,"The 2022 F1 ""Carrera GO!!!"" Slot Cars (Red Bull, Ferrari and Mercedes). Not the best looking things to be honest. https://t.co/jwx6eHEgL6",the  f carrera go slot cars red bull ferrari and mercedes not the best looking things to be honest httpstcojwxehegl,0.5333333333333333,0.39999999999999997,negative,"['the', 'f', 'carrera', 'go', 'slot', 'cars', 'red', 'bull', 'ferrari', 'and', 'mercedes', 'not', 'the', 'best', 'looking', 'things', 'to', 'be', 'honest', 'httpstcojwxehegl']","['f', 'carrera', 'go', 'slot', 'cars', 'red', 'bull', 'ferrari', 'mercedes', 'best', 'looking', 'things', 'honest', 'httpstcojwxehegl']","['f', 'carrera', 'go', 'slot', 'car', 'red', 'bull', 'ferrari', 'merced', 'best', 'look', 'thing', 'honest', 'httpstcojwxehegl']"
22,"Some shocking moments from the Singapore Grand Prix !!!

#F1 #Formula1 #SingaporeGP #verstappen #Schumacher #Sainz #Ferrari #RedBullRacing https://t.co/Xhbhgv0nY6","some shocking moments from the singapore grand prix 

f formula singaporegp verstappen schumacher sainz ferrari redbullracing httpstcoxhbhgvny",-0.25,1.0,positive,"['some', 'shocking', 'moments', 'from', 'the', 'singapore', 'grand', 'prix', 'f', 'formula', 'singaporegp', 'verstappen', 'schumacher', 'sainz', 'ferrari', 'redbullracing', 'httpstcoxhbhgvny']","['shocking', 'moments', 'singapore', 'grand', 'prix', 'f', 'formula', 'singaporegp', 'verstappen', 'schumacher', 'sainz', 'ferrari', 'redbullracing', 'httpstcoxhbhgvny']","['shock', 'moment', 'singapor', 'grand', 'prix', 'f', 'formula', 'singaporegp', 'verstappen', 'schumach', 'sainz', 'ferrari', 'redbullrac', 'httpstcoxhbhgvni']"
23,The latest F1 News Daily! https://t.co/q688vXJ3n9 Thanks to @tifosiclub #f1 #ferrari,the latest f news daily httpstcoqvxjn thanks to tifosiclub f ferrari,0.2333333333333333,0.3666666666666667,positive,"['the', 'latest', 'f', 'news', 'daily', 'httpstcoqvxjn', 'thanks', 'to', 'tifosiclub', 'f', 'ferrari']","['latest', 'f', 'news', 'daily', 'httpstcoqvxjn', 'thanks', 'tifosiclub', 'f', 'ferrari']","['latest', 'f', 'news', 'daili', 'httpstcoqvxjn', 'thank', 'tifosiclub', 'f', 'ferrari']"
24,"@manofbird I agreee....Gotta luv the espressos, the latte, the gelato, the sporesata, the cappucino, the canoli , Ferrari &amp; F1, Seria A soccer, World Cups championships",manofbird i agreeegotta luv the espressos the latte the gelato the sporesata the cappucino the canoli  ferrari amp f seria a soccer world cups championships,0.0,0.0,positive,"['manofbird', 'i', 'agreeegotta', 'luv', 'the', 'espressos', 'the', 'latte', 'the', 'gelato', 'the', 'sporesata', 'the', 'cappucino', 'the', 'canoli', 'ferrari', 'amp', 'f', 'seria', 'a', 'soccer', 'world', 'cups', 'championships']","['manofbird', 'agreeegotta', 'luv', 'espressos', 'latte', 'gelato', 'sporesata', 'cappucino', 'canoli', 'ferrari', 'amp', 'f', 'seria', 'soccer', 'world', 'cups', 'championships']","['manofbird', 'agreeegotta', 'luv', 'espresso', 'latt', 'gelato', 'sporesata', 'cappucino', 'canoli', 'ferrari', 'amp', 'f', 'seria', 'soccer', 'world', 'cup', 'championship']"
25,"A collection of rear wing specs used by #Ferrari, #Mercedes, #AstonMartin and #RedBull 🏎️🔎
.
Remember: smaller wing -&gt; less downforce -&gt; less drag -&gt; higher top speeds 🏎️💨
.
#F1 #Formula1 https://t.co/QrURo7HNbp","a collection of rear wing specs used by ferrari mercedes astonmartin and redbull 🏎️🔎

remember smaller wing gt less downforce gt less drag gt higher top speeds 🏎️💨

f formula httpstcoqrurohnbp",0.05277777777777778,0.28402777777777777,positive,"['a', 'collection', 'of', 'rear', 'wing', 'specs', 'used', 'by', 'ferrari', 'mercedes', 'astonmartin', 'and', 'redbull', 'remember', 'smaller', 'wing', 'gt', 'less', 'downforce', 'gt', 'less', 'drag', 'gt', 'higher', 'top', 'speeds', 'f', 'formula', 'httpstcoqrurohnbp']","['collection', 'rear', 'wing', 'specs', 'used', 'ferrari', 'mercedes', 'astonmartin', 'redbull', 'remember', 'smaller', 'wing', 'gt', 'less', 'downforce', 'gt', 'less', 'drag', 'gt', 'higher', 'top', 'speeds', 'f', 'formula', 'httpstcoqrurohnbp']","['collect', 'rear', 'wing', 'spec', 'use', 'ferrari', 'merced', 'astonmartin', 'redbul', 'rememb', 'smaller', 'wing', 'gt', 'less', 'downforc', 'gt', 'less', 'drag', 'gt', 'higher', 'top', 'speed', 'f', 'formula', 'httpstcoqrurohnbp']"
26,@OmarHosein2 @stella__f1 we could suffer at ferrari?,omarhosein stellaf we could suffer at ferrari,0.0,0.0,negative,"['omarhosein', 'stellaf', 'we', 'could', 'suffer', 'at', 'ferrari']","['omarhosein', 'stellaf', 'could', 'suffer', 'ferrari']","['omarhosein', 'stellaf', 'could', 'suffer', 'ferrari']"
27,"@SimonTheWatcher @footballintere4 @FanaticsFerrari i don’t think anyone has stolen any titles, i don’t really use stats to rank drivers since F1 relies so much on the team and car, yes I dislike Ferrari but that’s because they’re run by clowns and I feel for vettel and leclerc for having to put up with it just like alonso did",simonthewatcher footballintere fanaticsferrari i don’t think anyone has stolen any titles i don’t really use stats to rank drivers since f relies so much on the team and car yes i dislike ferrari but that’s because they’re run by clowns and i feel for vettel and leclerc for having to put up with it just like alonso did,-0.13333333333333336,0.43333333333333335,positive,"['simonthewatcher', 'footballintere', 'fanaticsferrari', 'i', 'don', 't', 'think', 'anyone', 'has', 'stolen', 'any', 'titles', 'i', 'don', 't', 'really', 'use', 'stats', 'to', 'rank', 'drivers', 'since', 'f', 'relies', 'so', 'much', 'on', 'the', 'team', 'and', 'car', 'yes', 'i', 'dislike', 'ferrari', 'but', 'that', 's', 'because', 'they', 're', 'run', 'by', 'clowns', 'and', 'i', 'feel', 'for', 'vettel', 'and', 'leclerc', 'for', 'having', 'to', 'put', 'up', 'with', 'it', 'just', 'like', 'alonso', 'did']","['simonthewatcher', 'footballintere', 'fanaticsferrari', 'think', 'anyone', 'stolen', 'titles', 'really', 'use', 'stats', 'rank', 'drivers', 'since', 'f', 'relies', 'much', 'team', 'car', 'yes', 'dislike', 'ferrari', 'run', 'clowns', 'feel', 'vettel', 'leclerc', 'put', 'like', 'alonso']","['simonthewatch', 'footballinter', 'fanaticsferrari', 'think', 'anyon', 'stolen', 'titl', 'realli', 'use', 'stat', 'rank', 'driver', 'sinc', 'f', 'reli', 'much', 'team', 'car', 'ye', 'dislik', 'ferrari', 'run', 'clown', 'feel', 'vettel', 'leclerc', 'put', 'like', 'alonso']"
